transmettre	to transmit	7	e300770afdcb9110b1c0891600aa1805	Merci, mais j’ai déjà transmis une requête à l’administrateur.	Il doit transmettre le message à ses collègues immédiatement.
un appareil	a device	7	cdbe6516bfcc62d3d1055a5613998e91	L’appareil doit être placé à six pieds du mur.	L'appareil photo est essentiel pour capturer de beaux souvenirs.
correspondre	to correspond	7	3908c626fec1527522b91b37deea1761	Le sujet de votre projet doit correspondre à ce dont nous avons parlé hier.	Les deux versions du document doivent correspondre parfaitement.
associer	to associate	7	99571e1f2e8cdc792431c30dd58a0403	Il est associé à l’une des plus grandes entreprises d’Europe.	Ce parfum est souvent associé à des souvenirs d'enfance.
un trait	a trait	7	3f0140a10fdfeac68650d8830af5129e	Elle est très drôle, je trouve ce trait charmant.	La gentillesse est l'un de ses traits les plus marquants.
une référence	a reference	7	b8c6c3c3a2ab4f049a81e88d789ce406	Ce film faisait une référence aux Jeux Olympiques.	Ce livre est une référence incontournable dans le domaine.
le bois	the wood	7	87fdfe4d81b606cf91bdfe872417c3a9	Cette table en bois de pin est magnifique.	Ils ont utilisé du bois local pour construire leurs maisons.
une publication	a publication	7	ffc1cd98c60dd676b11fff160fd483a6	Il a été forcé de supprimer sa publication blessante.	Sa dernière publication a suscité beaucoup d'intérêt.
un symbole	a symbol	7	35ff866f34bb622cfd075a057ef3f82a	Cette bague est un symbole de notre amour.	Ce drapeau est un symbole de liberté et d'indépendance.
la consommation	the consumption	7	79c24f675bc246af232f3c3eaf67c6ab	La consommation de breuvages alcoolisés est interdite sur la terrasse.	La consommation d'énergie a augmenté au cours de l'année.
idéal / idéale	ideal	7	52485a280de137c06bd242851d948364	Cet endroit est idéal pour nos vacances d’été.	Ce parc est l'endroit idéal pour une promenade en famille.
le chômage	unemployment	7	c5c6a6a8cd23128486f63956646b50b0	Le taux de chômage a encore augmenté cette année.	Le taux de chômage a diminué ce trimestre.
le courage	the courage	7	21214b6dc0fbaf81d2b994912d69a16f	Je n’ai pas le courage de lui parler.	Il a montré beaucoup de courage face à l'adversité.
identifier	to identify	7	073eafd329430aad817e5f0f835746fc	Pouvez-vous identifier votre agresseur parmi ces quatre individus?	Il a du mal à identifier le coupable parmi les suspects.
un entretien	an interview / maintenance	7	3671c90e631ad3a9bb26886a79bc24f1	Eugène a un entretien d’embauche pour devenir préposé à l’entretien.	Elle prépare son entretien d'embauche pour demain.
encourager	to encourage	7	5bd2a1d20efec2741daf7d04fb638ee2	Merci de m’encourager, c’est très apprécié.	Ses parents l'ont toujours encouragée à poursuivre ses rêves.
un kilomètre	a kilometer	7	c5840cdf32a0be00613f065554976d58	Il est parti travailler à des milliers de kilomètres de sa ville natale.	Ils ont parcouru plusieurs kilomètres à pied pour arriver là.
dérouler	to unroll	7	4a53009d8314f84d9497baa897b84f7a	Aide-moi à dérouler le tapis, nous allons le placer dans ta chambre.	La réunion se déroulera dans la salle de conférence principale.
une identité	an identity	7	1582392cbe64e0c368ceb137ef72d8f3	L’identité du meurtrier n’a pas encore été découverte.	La reconnaissance de son identité culturelle est essentielle.
la reconnaissance	recognition	7	d1be559e747174346c60fdef9386958b	Tout son travail lui a apporté beaucoup de reconnaissance.	Son travail mérite une reconnaissance internationale.
signaler	to report	7	2616b5fe488b4b3acae622fd9744c378	Elle est allée signaler l’incident au garde de sécurité.	Il a signalé le problème technique à l'équipe de maintenance.
une division	a division	7	fc18e805fe3324e8dd61ddb6cf32cea8	J’ai entendu dire qu’il travaillait pour une division du gouvernement.	La division des responsabilités est clairement définie.
un contexte	a context	7	4d7f5efcd88612654df1751ab5a4bbc6	Ce mot est plus facile à comprendre en contexte.	Il faut comprendre le contexte historique pour interpréter ce texte.
coupable	guilty	7	99579c9fac4e4514d7c3694c306a982c	Il est coupable d’avoir volé des cigarettes derrière le comptoir.	Le tribunal a déclaré l'accusé coupable de vol à main armée.
favorable	favorable	7	bdba1a2e24f127b1af76c390222463bf	Nous irons au parc quand la météo sera plus favorable.	Les conditions météorologiques sont favorables pour une sortie en mer.
un amendement	an amendment	7	4b6634593093b1ac4bf023997d99b7e2	Trois des députés sont en faveur de cet amendement.	L'amendement à la loi a été adopté à l'unanimité.
août	august	7	95ec2dd77761c66a5176528fa438a428	Il reviendra de voyage le sept août.	Ils partent en vacances au mois d'août chaque année.
attribuer	to attribute	7	d8d38ac47f354f7bb840e6042897fc15	Tu ne peux pas lui attribuer tout le mérite.	Ils ont attribué le succès du projet à l'équipe de développement.
courir	to run	7	75ca4d8c81aa8615542d3e7139864f42	Cours, ou tu manqueras l’autobus!	Il aime courir tous les matins pour rester en forme.
un examen	an exam	7	c76d3a9ca0ceb236e78a82d152641c80	Il ne me reste plus qu’un examen, puis c’est les vacances.	Il a réussi son examen final avec distinction.
un personnage	a character	7	aa9c28371bd0651871252dc16dea7938	Sharon est mon personnage favori dans cette série télé.	Ce personnage de roman est très complexe et intéressant.
une obligation	an obligation	7	9bacb32da05301966fb75239b89c4602	Vous devez signer le document, c’est une obligation.	Le respect des règles est une obligation pour tous les étudiants.
inconnu / inconnue	unknown	7	7c3b0fd49ddf4c34db41b8535150058e	Nous nous sommes retrouvés sur un territoire inconnu.	L'identité du voleur est encore inconnue à ce jour.
échanger	to exchange	7	1cd4ef70f55e583e759818de76143855	Je vous appellerai ce soir pour échanger quelques mots.	Ils ont décidé d'échanger leurs numéros de téléphone.
un montant	an amount	7	483f2501981b44151c2c451d50d4f45b	Le montant d’argent nécessaire est trop élevé pour moi.	Le montant total de la facture s'élève à 250 euros.
éliminer	to eliminate	7	2b712abec3cdca6bce0925a13a67ae15	Nous travaillons fort pour éliminer toutes vos inquiétudes.	Ils ont réussi à éliminer toutes les erreurs du rapport.
dénoncer	to denounce	7	eaf801eeef408879ca5fa634a8d3a853	Cette injustice doit être dénoncée.	Elle a dénoncé les pratiques discriminatoires de son employeur.
un tableau	a painting / a board	7	70b63e192fad53cfdcdab713254ff722	Certaines classes ont encore un tableau noir.	Le tableau de bord affiche toutes les informations importantes.
exclure	to exclude	7	6d8b2c098a6601edaa6c26dfa07b0ebb	Nous ne pouvons pas exclure la possibilité qu’il arrive en retard.	Ils ont décidé d'exclure cette option de leur plan.
un meurtre	a murder	7	41e017df923c0f2689359cb8484657a7	Le meurtre a été commis pendant la nuit.	L'inspecteur enquête sur un meurtre mystérieux dans la ville.
un exemplaire	a copy	7	d770f1285c863702442719d1764e8289	Je vais lui demander de signer mon exemplaire de son livre.	Chaque participant recevra un exemplaire du rapport.
une propriété	a property	7	ed6a34c90d4ce938c63d6e3f5a9070a2	Cette terre est la propriété de ma famille depuis des centaines d’années.	La propriété est située en bordure de la rivière.
final / finale	final	7	f05903be924103bb973763f8436321d7	Je ne suis pas encore prêt à remettre la version finale.	Ils ont remporté la coupe dans le match final.
un site	a site	7	9b2ef672ac63d4d6a9846625f02afee7	Des clôtures nous empêchent d’entrer sur le site.	Ce site archéologique attire des visiteurs du monde entier.
une séance	a session	7	ccf44f5b4760c6f1ebad93a340264469	On se revoit dans une semaine pour la prochaine séance.	La séance de méditation a duré une heure.
une ouverture	an opening	7	abb0a3d833c2305dc4063101bee482e4	Il y a une ouverture au bas de la cannette.	L'entreprise a annoncé une nouvelle ouverture de magasin.
élire	to elect	7	fa25cd95ee973899fe86ea5a3faa9ad0	Nous avons le pouvoir d’élire nos représentants.	Ils vont élire un nouveau président l'année prochaine.
une baisse	a drop	7	baa8f02a89a028177fcf5fdbe68ac2f6	Les profits ont subi une baisse importante cette année.	Il y a eu une baisse significative des ventes ce trimestre.
une inquiétude	a concern	7	fdae4fdfa2b9dceb30843505655a9e19	Nous nous occuperons de faire disparaître vos inquiétudes.	L'inquiétude principale est la sécurité des travailleurs.
israélien / israélienne	israeli	7	14018fdc14573e3f8c1daf0bac0855bf	Le représentant israélien fera un discours cet après-midi.	Il a rencontré des chercheurs israéliens lors de la conférence.
une représentation	a representation	7	5c97995e030af9856c27a65034f5bd06	Nous irons voir la représentation de vingt heures au cinéma.	Cette pièce de théâtre offre une représentation émouvante.
une durée	a duration	7	670f62902a0daf7ad4e2c64105e4df6b	Vous devez respecter cette règle pendant toute la durée du contrat.	La durée du vol est d'environ six heures.
un mandat	a mandate	7	a527c562fbfe9aaaa43997f66fe55c85	Cet engagement fait partie de notre mandat.	Il a été élu pour un nouveau mandat de quatre ans.
quinze	fifteen	7	242e50470ddca75984afce72bc9ba8d6	Tiens bon, il ne te reste que quinze minutes de classe.	Il est parti il y a quinze minutes pour la réunion.
vide	empty	7	26f5205ec88ac076a075b69c4404d8c5	Comment se fait-il que la bouteille soit déjà vide?	La boîte était vide quand il l'a ouverte.
un statut	a status	7	547cd7b28bb8baad4667708b9e4f9bc4	J’ignore quel est son statut matrimonial.	Son statut de résident permanent lui donne certains droits.
un essai	a try	7	9da97efdb821ac315ade0628c5dc3f68	Devine la nouvelle, tu as droit à trois essais!	Il a réussi son premier essai à l'examen de conduite.
