un effet	an effect	1	a3d29d96b17129c2d8c1aff6a6e4865b	Paul sait comment se faire remarquer, il a vraiment un effet sur les gens.	Les médicaments ont eu un effet positif.
une affaire	a matter	1	ca5090be1312bfd667e4b60f833568f7	Je vais te rappeler plus tard, j’ai une affaire importante à régler.	C'est une affaire délicate à gérer.
arriver	to arrive	1	45788f7ecff6a11a73fbe78183bf5080	Puisque nous sommes partis à sept heures, nous allons arriver vers le dîner.	Quand vas-tu arriver à la gare ?
servir	to serve	1	a243f631f1705e25d102d5fb4fc1a627	Dans mon cours de cuisine, j’apprendrai à servir les meilleurs plats.	Cette machine sert à fabriquer du pain.
un mois	a month	1	54829567cc6cb66a1e685f2f140405c3	J’irai voir un concert à Toronto dans un mois.	Nous sommes en juillet, c'est un beau mois.
jamais	never	1	375d7bba9c2e1f9dc58e9f56f1b13fff	De quoi parles-tu ? Je n’ai jamais entendu parler d’une telle chose.	Je ne suis jamais allé en Australie.
car	because	1	eedfe78f4240b2b9d0bd0b027cec9e9b	Je n’ai pas pu prendre ton appel, car j’étais dans la douche.	Il est en retard car il a raté son bus.
possible	possible	1	0d3bf4169090aeee52419de333dd29ad	Tout est possible lorsqu’on travaille assez fort.	Est-il possible de changer la date de la réunion ?
tant	so much / so many	1	784aca1c8a2a56d711d15941359ec0ca	Mon père est extrêmement généreux ; je l’aime tant.	Elle a tant de livres qu'elle ne sait pas où les mettre.
vers	towards	1	463ef6d5531338ad4a31a0801709f919	Envoie la balle vers moi ! Je sais que je peux marquer!	Il marche vers l'église au bout de la rue.
un besoin	a need	1	686acab6c0ebdac0c3b4a9e91a8c80e6	J’ai un besoin urgent de mettre de l’argent de côté pour mon voyage cet été.	Il a un besoin urgent de repos.
revenir	to come back	1	79d4dc7a8404e94bd860bca367a1cc63	Il est parti ce matin et il va seulement revenir dans deux mois.	Il va revenir demain matin.
sembler	to seem	1	00dd866c1ab9a35b2db65d7fd2eb7565	Je te l’ai dit vingt fois, mais tu ne sembles pas comprendre.	Il semble fatigué aujourd'hui.
un moyen	a means	1	6e18e49b5452b6e82e6a775dd93492b6	L’autobus est un moyen de transport que je préfère éviter.	Il cherche un moyen de résoudre ce problème.
un groupe	a group	1	3c6d817167abe11bc13bfc6636dfccc8	Un de mes collègues enseigne à un groupe de trente-deux élèves.	Ils sont membres d'un groupe de musique.
un problème	a problem	1	982ab673be5fe898c003d990884e9377	J’aimerais que tu m’aides à résoudre un problème.	C'est un gros problème à résoudre.
un rapport	a report	1	4f8450a97d75328b037a4ee485c57d08	Je dois aller au bureau, j’ai un rapport à remettre à mon patron.	Il a rédigé un rapport détaillé sur le projet.
dès que	as soon as	1	88e84265a9ba61f3d9a3f1bc33b218ba	Je commence à m’inquiéter, appelle-moi dès que tu arrives à l’hôtel.	Dès que tu seras prêt, nous partirons.
peut-être	maybe	1	14f71dbef6048b42c7552240c79e2e31	Peut-être que tu devrais arrêter de croire tout ce que Pierre te dit.	Peut-être viendront-ils à la fête ce soir.
maintenant	now	1	2a1da4e82059682b264af8b26cd2e494	Elle part demain, alors c’est maintenant ou jamais!	Maintenant, il est temps de se détendre.
pourquoi	why	1	59ec74350e281cb3fb84385dcc8651f7	Pourquoi crois-tu que les voisins déménagent ?	Pourquoi n'êtes-vous pas venu hier ?
meilleur / meilleure	better / best	1	01a9ab653b4c15ca42dc3fd4ad2686cf	Elle est la meilleure pianiste que j’aie entendue depuis longtemps.	C'est le meilleur restaurant de la ville.
une vue	a view	1	628b2a504b0e51527d26bf69324f4a70	Nous aimerions réserver une chambre avec une vue sur la mer.	De cette montagne, on a une vue magnifique.
trop	too much / too many	1	26aaf7bc311903f68fb75f186671f6e1	Tu t’en fais trop avec des choses sans importance.	Il y a trop de monde ici, partons.
laisser	to let / to leave (something or someone)	1	379b53d6c248d0873bf84a77c1cf0c51	Yves m’a dit qu’il allait me laisser. Apparemment, je suis « incapable de le laisser travailler en paix ».	Ne laissez pas vos enfants jouer près de la route.
un ordre	an order	1	e6e9cdd6b324ddd379da1794451aef03	Range ta chambre, c’est un ordre !	Il a reçu un ordre de mission pour partir.
devant	in front of	1	576a16972ea1121de32318d8aaf71bf7	Je n’ai rien pu voir, car il y avait trop de personnes devant moi.	Il est assis devant moi dans la classe.
recevoir	to receive	1	8582d4116ce8a019306474ec1851be9d	Je m’entraîne tous les jours pour recevoir cette médaille d’excellence.	Elle a reçu une lettre de son ami.
répondre	to answer	1	42fb827eb03feef071fad7bd4d17469c	Je ne peux pas répondre à toutes tes questions.	Merci de répondre à mes questions rapidement.
long / longue	long	1	d13061790667718f2d2c6a3593403cda	J’ai passé une longue journée au bureau, j’ai besoin de me détendre.	C'est un chemin long mais agréable à parcourir.
un service	a service / a favor	1	9c94405aa63afff57bdf74b0ff8a74d1	Rendez-vous service et offrez un meilleur service à la clientèle!	Il a rendu un grand service à son ami.
un / une ministre	a minister	1	a7093b400b381398c84861085e833b2a	Nous avons réellement besoin d’un ministre de l’Éducation qualifié.	Le ministre de l'Éducation a fait une annonce importante.
vivre	to live	1	5d5a6061e0a63b6662aea3da27a62443	Je préfèrerais vivre à la campagne qu’au centre-ville.	Ils vivent dans une petite maison à la campagne.
chez	at / to (someone’s)	1	f0fc7635d42a4166e29e18f493e3b2de	On peut manger chez moi ou on peut aller chez Marie-Ève.	Je vais chez mes grands-parents ce week-end.
te	you / yourself	1	ccc17677701abee182feadcc5890371d	Tu te coupes toujours avec ce couteau de cuisine, fais attention!	Tu te prépares pour la soirée ?
rappeler	to call back / to remind of	1	61b3ca548938264ee711455de8c548d9	Je dois rappeler Jasmine pour lui rappeler de ne pas oublier ses clés.	Je te rappelle demain matin pour confirmer.
en face de	across from / opposite	1	849bc814017ff0f348e53ed284cd372b	Elle était en face de moi, mais je n’ai pas été capable de lui dire la vérité.	Le magasin est en face de la bibliothèque.
accepter	to accept	1	c887a99962f45dcc1a4d16e1dba6fcf0	Tu dois accepter mon invitation pour qu’on puisse jouer en ligne ensemble.	Elle a finalement accepté l'invitation à dîner.
agir	to act	1	981901b42f8835a61a1e1a6ef64dfe7a	Si tu ne peux pas agir de façon appropriée, on rentre à la maison.	Il faut agir rapidement pour résoudre ce problème.
simple	simple	1	2f43b9569b28d3391e57e0b9132c3a6d	J’aimerais devenir médecin, mais ce n’est pas si simple.	La recette est simple à suivre.
