portafoglio	wallet	3	fa5f31a5d0f9c0d744d450852751cf83	Ho dimenticato il portafoglio a casa stamattina e non posso pagare il caffè al bar del centro.	Un portafoglio nero.
malato	sick	3	a0de0a96c40393fcdb586c95b9d20c7f	Sono malato da tre giorni e devo restare a casa a letto per riposarmi un po' prima di lavorare.	Mi sento malato.
sano	healthy	3	7ec7d4601015ff019f3433e59a32a078	Una dieta sana ed equilibrata con tanta frutta e verdura aiuta a vivere meglio e più a lungo.	Una vita sana.
febbre	fever	3	b1632e7d9b0d065a14b5fff7e4b75850	Ho la febbre alta da ieri sera e devo prendere la medicina ogni sei ore esatte come prescritto.	Misuro la febbre.
raffreddore	cold (illness)	3	31d3947786967956a73146a8e4c28db4	Ho preso un brutto raffreddore al mare a causa del vento freddo della sera scorsa improvviso.	Un forte raffreddore.
tosse	cough	3	2c64d76b5f6ce7ee810ee1d355f63bd6	La tosse mi tiene sveglio la notte e non riesco a riposare bene per niente ultimamente purtroppo.	Una tosse secca.
ferita	wound	3	207ee49339654b6a0a971ab6efbd429c	La ferita al braccio si sta lentamente rimarginando e tra qualche giorno sarà completamente guarita.	Una piccola ferita.
malattia	illness	3	cb049f6a23c05d05d407e94003cc1cfc	La malattia di mio padre è grave e dobbiamo prenderci cura di lui giorno e notte sempre.	Una brutta malattia.
sintomo	symptom	3	c495d5dc9a0a95cf54160da449679912	Il primo sintomo dell'influenza è il mal di testa seguito dalla febbre alta improvvisa e fastidiosa.	Sintomi gravi.
pillola	pill	3	f2dea04491baf83182c4f03dffa9bed6	Devo prendere una pillola dopo cena ogni giorno per il mal di testa frequente che ho ultimamente.	Una pillola al giorno.
guarire	to heal	3	b69b704517dc234a81ae278ed2708ca6	Spero di guarire presto da quest'influenza per poter tornare al lavoro la prossima settimana finalmente.	Guarisco presto.
scegliere	to choose	3	22e802b523faf68a972b52f327aa68b3	Devo scegliere quale università frequentare e la decisione mi sta facendo davvero impazzire ultimamente.	Scegli tu.
succedere	to happen	3	fac4cf20302d6d87f32505a673a9b9b9	Cosa è successo ieri sera durante la festa di Marco a casa sua nuova in periferia?	È successo qualcosa?
sembrare	to seem	3	03f1b87f90a27d98e6f809cfe10c2200	Sembri stanco oggi, hai dormito abbastanza la notte scorsa per affrontare la giornata pesante?	Sembra giusto.
riuscire	to succeed / manage	3	4e29a1ee9c143a51e8a47d84ce2da20a	Non riesco a finire questo lavoro entro stasera senza l'aiuto di tutti i miei colleghi disponibili.	Ci riesco.
decidere	to decide	3	49a22cdf1409938050f84a50139c7dbf	Devo decidere prima di domani se accettare quel nuovo lavoro all'estero o restare qui in Italia.	Hai deciso?
immaginare	to imagine	3	4cdf1a926ea6f930e2f9667f1e310430	Posso solo immaginare quanto sia stato difficile per te affrontare quella situazione da solo per mesi.	Immagina che bello.
restare	to stay / remain	3	5dab81a1e7dced62f3078106f4c49f32	Voglio restare ancora un po' al mare prima di tornare in città a lavorare in ufficio.	Resta con me.
esistere	to exist	3	5e726e0166838976efe2dfca6ea857ba	Non credo che esista una soluzione perfetta a questo problema così complicato e difficile da risolvere.	Esiste davvero.
funzionare	to work / function	3	c3be2a058f24bc5f793a939ffdd187a7	Il computer non funziona da ieri sera e devo chiamare un tecnico per ripararlo subito al più presto.	Funziona bene.
occorrere	to be needed	3	1db47b5349b0eade98588ebe876108f2	Mi occorre un nuovo computer per il lavoro perché quello vecchio non è più affidabile per niente.	Mi occorre tempo.
fame	hunger	3	f86f4786f77a482d600ad9366292cff4	Ho una fame da lupi e non vedo l'ora di mangiare la cena preparata da mia madre stasera.	Ho fame.
sete	thirst	3	a7222f153e5c1450b46a3446c957eae8	Ho una sete terribile dopo aver corso per due ore al sole della giornata estiva calda e afosa.	Ho sete.
voglia	desire / want	3	420d8174943e805fbb019ac36af0ae89	Ho voglia di un buon caffè caldo dopo il pranzo abbondante con tutta la famiglia riunita oggi.	Ho voglia di gelato.
bisogno	need	3	8726092d8a5a8fdb99bd3b8660db7f53	Ho bisogno di una vacanza lunga per rilassarmi dopo questi mesi di lavoro intenso e stressante difficile.	Ho bisogno di te.
esperienza	experience	3	1fc4ff816f5f9f94f846f35d7f2822ec	L'esperienza di lavoro all'estero mi ha cambiato profondamente e mi ha aperto la mente a nuove culture.	Una bella esperienza.
futuro	future	3	5c72b79ee66109770d5813eb17112c12	Il futuro è incerto e dobbiamo essere pronti ad adattarci a qualunque cambiamento ci aspetti più avanti.	Pensa al futuro.
passato	past	3	286ec838b8bcd72e241c3a2a2546e24e	Il passato non si può cambiare ma possiamo imparare dai nostri errori per il futuro migliore insieme.	Nel passato.
presente	present	3	c0cbc0bd20dabae8cc946f893d6e7b41	Bisogna vivere il presente perché ieri è già passato e domani non è ancora arrivato davvero.	Vivi il presente.
decisione	decision	3	4a18d948dcc2f5bacbd4c7021046c8a5	La decisione di trasferirmi all'estero è stata difficile ma necessaria per la mia carriera professionale futura.	Una grande decisione.
scelta	choice	3	fa713bbc7a139d202c77cd098b6b3907	La scelta tra studiare all'università o iniziare subito a lavorare è davvero molto difficile per i giovani.	Una scelta giusta.
bagnato	wet	3	105d197b5be99835552e9611a916883f	I miei capelli sono ancora bagnati dopo la doccia e non ho tempo di asciugarli bene stamattina.	Pavimento bagnato.
asciutto	dry (not wet)	3	048f4d90414c6659892d48212c8a30f3	I vestiti sono finalmente asciutti dopo essere stati sul balcone tutto il pomeriggio al sole caldo.	Capelli asciutti.
salato	salty	3	120bd7cb27f9d14d35637e284b4406a9	Questo piatto è troppo salato per i miei gusti e non riesco a finirlo nonostante la fame che ho.	Acqua salata.
amaro	bitter	3	cb2cb7f993366424e65420afe184c7a9	Il caffè amaro al mattino è perfetto per svegliarsi e iniziare bene la giornata di lavoro pesante.	Sapore amaro.
acido	sour / acid	3	2f16bf897cd577f04eba36f687352163	Il limone è troppo acido per me e preferisco aggiungere un po' di zucchero al succo per addolcirlo.	Sapore acido.
maturo	ripe / mature	3	f89c77c4e10cd973813778765a186558	Questa pera è molto matura e dolcissima, perfetta per fare una buona marmellata casalinga di stagione.	Frutto maturo.
crudo	raw	3	58266a6ed9386318a4afdf356696fcaf	Il pesce crudo è una specialità della cucina giapponese che amo mangiare al ristorante del centro.	Carne cruda.
cotto	cooked	3	8fcb4ec3d7dc5d5eb9aaee8be82a71b4	Il pollo è cotto al punto giusto e profuma di rosmarino e olio d'oliva extra vergine ottimo.	Riso cotto.
pulito	clean	3	87e12e9d29588c6368a25f8bf6847298	Il bagno è pulito e profumato dopo aver passato tutto il pomeriggio a fare le pulizie a fondo.	Aria pulita.
sporco	dirty	3	dc4440853a6e577ba93791bcab005383	Il pavimento è sporco di fango perché i bambini sono entrati con le scarpe piene di terra del giardino.	Vestiti sporchi.
io faccio	I do / I make	3	435a98c2dfb9ff3ab97041138ef2ac45	Io faccio sempre la spesa il sabato mattina al mercato del centro storico.	Faccio i compiti.
tu fai	you do / you make	3	5798340da5fcb43e80837f892ed172c9	Tu fai sempre del tuo meglio in tutto quello che decidi di intraprendere nella vita.	Cosa fai?
lui fa / lei fa	he does / she does	3	c2ab37bef4f48ee6909df0b15a24a041	Lui fa il medico in ospedale e lei fa l'insegnante alle scuole elementari del quartiere.	Fa caldo oggi.
noi facciamo	we do / we make	3	e69b9c0a481d36f4ef9e2f5c6bf8730f	Noi facciamo una passeggiata al parco ogni domenica pomeriggio se il tempo è bello.	Facciamo presto.
voi fate	you do / you make (pl)	3	8a4dbd9d39743817b4af6bafe8c710f9	Voi fate troppo rumore quando giocate tutti insieme nel cortile della scuola elementare.	Cosa fate stasera?
loro fanno	they do / they make	3	a34a9aad042fdf16b984d375570b8a37	Loro fanno volontariato in un'associazione che aiuta i bambini in difficoltà economiche.	Fanno tardi.
io vado	I go	3	b885ccb99eebe0790023a79ce22dc3cb	Io vado al lavoro in bicicletta ogni mattina anche quando piove leggermente sulla città.	Vado a casa.
tu vai	you go	3	95372b0110dca8e1aec520b726e906f3	Tu vai sempre di fretta e non hai mai tempo per fermarti a chiacchierare un attimo.	Dove vai?
lui va / lei va	he goes / she goes	3	dcf78ef058969e56ea936f1d9a354767	Lui va in palestra tre volte alla settimana e lei va a un corso di yoga.	Va a scuola.
noi andiamo	we go	3	ac44b13cc17177e3c236cf5f61c162ff	Noi andiamo in vacanza al mare ogni estate da quando i bambini erano molto piccoli.	Andiamo via!
voi andate	you go (pl)	3	958d09da8b65536f4abe0cd5faab2709	Voi andate al cinema stasera o preferite restare a casa a guardare un film?	Dove andate?
loro vanno	they go	3	488e356c78cb1f34079d211a2bfbb26a	Loro vanno al ristorante italiano del centro tutti i venerdì sera con gli amici di sempre.	Vanno via.
io dico	I say / I tell	3	570d2a618b28bf245ac4c5b54d8aa18f	Io dico sempre la verità anche quando è difficile e potrebbe ferire qualche sentimento.	Dico sì.
tu dici	you say / you tell	3	5bec00a77d356cb3705fb5639a74f6c4	Tu dici cose molto interessanti ogni volta che parliamo di politica o di filosofia.	Cosa dici?
lui dice / lei dice	he says / she says	3	abcac6ef33c37f59f1ce84f29051afd5	Lui dice che arriverà tardi e lei dice che ci raggiungerà direttamente al ristorante.	Lui dice di no.
noi diciamo	we say / we tell	3	8abf7fe04dcd1d9288c1aedac104981f	Noi diciamo a tutti che la festa è stata un grande successo davvero divertente.	Diciamo basta.
voi dite	you say / you tell (pl)	3	ff1c80b8e0f478bcf151ae6e166ffa6b	Voi dite sempre che dovremmo viaggiare di più ma poi non trovate mai il tempo libero.	Cosa dite?
loro dicono	they say / they tell	3	27242c37bb1c72d5780418433a4c24b2	Loro dicono che il nuovo film del regista italiano è davvero molto bello e profondo.	Dicono bugie.
io vengo	I come	3	2251055a4cacd36b765c3f896885034f	Io vengo da una piccola città del nord Italia molto vicino alle Alpi.	Vengo subito.
tu vieni	you come	3	2bfe6288783d68a91c4e8e4c53e746b2	Tu vieni alla festa di compleanno di Marco sabato sera o hai altri impegni urgenti?	Vieni con me?
lui viene / lei viene	he comes / she comes	3	afaa054d17978e5d29709697ad84f3b3	Lui viene a trovarmi ogni weekend e lei viene a cena ogni martedì sera.	Viene anche lui.
noi veniamo	we come	3	9aa64e14c50b57488abd4043c1dc075b	Noi veniamo dall'Italia ma viviamo all'estero da più di dieci anni ormai.	Veniamo presto.
voi venite	you come (pl)	3	c65ec554ef07b6e166111824e4d4e2a5	Voi venite con noi al concerto stasera o avete già altri programmi diversi?	Venite o no?
loro vengono	they come	3	34a58d12545472f1a1c88d615c25e85a	Loro vengono a trovarci ogni estate e restano da noi per tutto il mese di agosto.	Vengono insieme.
io parlo	I speak	3	b95e9caf05edf1b1feafaedb00152180	Io parlo italiano fluentemente e sto imparando il francese da circa due anni.	Parlo inglese.
tu parli	you speak	3	6cee2d8f8cb49bd2e9bf7188bbd50f55	Tu parli sempre con grande passione di tutti gli argomenti che ti stanno a cuore.	Parli troppo.
lui parla / lei parla	he speaks / she speaks	3	1144dc03cdab647bef2f8c94bf1f455b	Lui parla cinque lingue diverse e lei parla solo italiano e un po' di inglese.	Parla bene.
noi parliamo	we speak	3	b59eae177ec6e09f547c3a1e3fe045b6	Noi parliamo spesso al telefono anche se viviamo in città molto lontane fra di loro.	Parliamo dopo.
voi parlate	you speak (pl)	3	a52dd426cac9e2f86996490cbdf9252e	Voi parlate del progetto di lavoro o di qualcos'altro durante la pausa pranzo?	Parlate piano.
loro parlano	they speak	3	39356a68028835f83aa682e33a242657	Loro parlano sempre molto velocemente e a volte è difficile capire ogni singola parola.	Parlano italiano.
