hallo	hello / hi	0	598d4c200461b81522a3328565c25f7c	Hallo, schön dich zu sehen, wie war dein Wochenende mit der Familie?	Hallo, wie geht's?
auf Wiedersehen	goodbye	0	4f98ef2cbd2df0a2e9dd07c3762694e6	Auf Wiedersehen und vielen Dank für den schönen Abend bei Ihnen zu Hause.	Auf Wiedersehen!
guten Morgen	good morning	0	4faa741f094b5cd185bf24eec2521115	Guten Morgen, der Kaffee steht schon auf dem Tisch und das Frühstück ist auch bald fertig.	Guten Morgen, Schatz.
guten Abend	good evening	0	7ec2aa39370643a4040e0701a85b6107	Guten Abend, schön, dass Sie heute zu unserem kleinen Empfang gekommen sind, trotz des schlechten Wetters.	Guten Abend, alle zusammen.
gute Nacht	good night	0	7e3d01ffa485d05cd62f8467dc73ff67	Gute Nacht, schlaf gut und träum was Schönes, wir sehen uns morgen früh beim Frühstück wieder.	Gute Nacht, Kinder.
bitte	please / you're welcome	0	c8f17d7403ac5ff2896a713a7175ed19	Könnten Sie mir bitte den Weg zum Bahnhof zeigen, ich kenne mich in dieser Stadt überhaupt nicht aus.	Einen Kaffee, bitte.
danke	thank you	0	eedc18ce8c3cd817f5e321201de03a9f	Vielen Dank für deine Hilfe gestern, ohne dich hätte ich es nie geschafft, alles rechtzeitig fertigzustellen.	Danke schön.
gern geschehen	you're welcome	0	e425d835009dae85652d5305b2d178c6	Gern geschehen, ich helfe dir doch immer gerne, wenn du irgendwelche Probleme mit dem Computer hast.	Gern geschehen.
Entschuldigung	excuse me / sorry	0	5e7fdd568b18c8d7d29e1c827295206d	Entschuldigung, könnten Sie mir bitte sagen, wo der nächste Bahnhof ist, ich bin neu in dieser Stadt.	Entschuldigung, wie spät?
es tut mir leid	I'm sorry	0	9b670490ae088efde3e285c404dde084	Es tut mir wirklich leid für das, was gestern passiert ist, ich wollte dich auf keinen Fall verletzen.	Es tut mir leid.
ja	yes	0	a78c5bf69b40d464b954ef76815c6fa0	Ja, ich bin völlig deiner Meinung und ich möchte auch sehr gerne an diesem Projekt teilnehmen.	Ja, gerne.
nein	no	0	cabab3467223e23dc752e1a979647bd6	Nein, ich kann heute Abend leider nicht kommen, weil ich schon eine andere wichtige Verabredung habe.	Nein, danke.
wie geht's?	how are you?	0	c3b0b35e196ad49d802689c86d2b1c8c	Hallo, wie geht's dir denn so, ich habe dich schon eine ganze Weile nicht mehr gesehen?	Hallo, wie geht's?
mir geht's gut	I'm fine	0	fa34911ff9144ce8d1e38c1f220bde0b	Mir geht's gut, danke der Nachfrage, auch wenn ich wegen der Arbeit ein bisschen müde bin.	Mir geht's gut.
wie heißt du?	what's your name? (informal)	0	149b66f651455763aa0a7a0ede2d3dba	Freut mich, dich kennenzulernen, wie heißt du und woher kommst du eigentlich genau?	Wie heißt du?
ich heiße	my name is	0	46d661123e5fecbe5669cb19c1cd922a	Ich heiße Thomas und komme aus München, aber jetzt wohne ich in Berlin wegen der Arbeit.	Ich heiße Anna.
freut mich	nice to meet you	0	69c15dc27fa4ded34c1534e470274b96	Freut mich sehr, Sie kennenzulernen, ich habe schon viel Gutes über Sie von unseren gemeinsamen Freunden gehört.	Freut mich sehr.
sprechen Sie Englisch?	do you speak English? (formal)	0	71b9ed7f2000d93ef902c89a61136e21	Entschuldigung, sprechen Sie zufällig Englisch? Mein Deutsch ist noch nicht besonders gut.	Sprechen Sie Englisch?
ich verstehe nicht	I don't understand	0	192a763e6d771826c9e3c910c23ff412	Entschuldigung, ich verstehe nicht, was Sie sagen, könnten Sie bitte etwas langsamer sprechen?	Ich verstehe nicht.
ich weiß nicht	I don't know	0	1a5fdd532acd1d93ff49ae3579fecd6e	Ich weiß es wirklich nicht, tut mir leid, aber du kannst es ja mal bei jemand anderem versuchen.	Ich weiß nicht.
Hilfe!	help!	0	00852a408cfae9cc678a9a0b96f73386	Hilfe! Es gab einen Unfall auf der Hauptstraße, jemand ist verletzt, ruft schnell einen Krankenwagen!	Hilfe, schnell!
sprechen Sie bitte langsamer	please speak more slowly	0	061316300910dc04f5b586e44f8d94ee	Entschuldigung, sprechen Sie bitte langsamer, ich lerne erst seit Kurzem Deutsch.	Bitte langsamer.
können Sie das wiederholen?	can you repeat that? (formal)	0	97615b1fa8121e6765f2d8afdb954082	Entschuldigung, können Sie das bitte wiederholen? Ich habe Sie wegen des Lärms nicht verstanden.	Bitte wiederholen?
wie sagt man?	how do you say?	0	5e7e7b9bb18c524b8b7b89d9f919655c	Entschuldigung, wie sagt man dieses Wort auf Deutsch? Ich finde es in meinem Wörterbuch nicht.	Wie sagt man das?
wo	where	0	e0a0862398ccf49afa6c809d3832915c	Wo wohnst du jetzt und wo arbeitest du normalerweise unter der Woche?	Wo bist du?
wann	when	0	5bc0791352002fc5316b9e59022e1513	Wann kommst du heute Abend nach Hause, dann mache ich dir dein Lieblingsessen?	Wann fährst du?
warum	why	0	d24ddce369392f6e1d6dcf62e8c0ae3a	Warum bist du gestern Abend nicht zu Marias Geburtstagsfeier gekommen?	Warum nicht?
wie	how / as	0	3e413f53d9f7c57b7250e9515a8d0d4d	Wie geht es dir heute und wie war dein Arbeitstag bisher so?	Wie geht's?
wie viel kostet das?	how much does it cost?	0	fc309254480e99db4b8b66c242a3617a	Entschuldigung, wie viel kostet dieses Buch, das ich im Schaufenster gesehen habe?	Wie viel kostet das?
wo ist die Toilette?	where is the toilet?	0	a984f29466aada28ce4a030397dda40e	Entschuldigung, wo ist die Toilette? Ich bin zum ersten Mal hier und kenne mich noch nicht aus.	Wo ist die Toilette?
ich möchte	I would like	0	09e91dbca9833ee9550928dbb2eef6f9	Ich möchte einen Kaffee und ein Croissant mit Marmelade, bitte, und dazu noch ein Glas Wasser.	Ich möchte Kaffee.
die Rechnung, bitte	the bill, please	0	744825286b8bc377f857b7249b8a67a1	Entschuldigung, die Rechnung, bitte. Wir sind fertig mit dem Essen und möchten jetzt gerne zahlen.	Die Rechnung, bitte.
das Wasser	water	0	38a6d170721ce0302332d7640951aa4a	Das Wasser aus der Leitung in dieser Stadt ist sehr gut und man kann es ohne Probleme trinken.	Ich trinke Wasser.
das Essen	food / meal	0	4729f8a0e3216e9b92a5afcbdf92beb2	Das Essen in diesem Restaurant ist wirklich ausgezeichnet, ich kann es jedem nur wärmstens empfehlen.	Das Essen ist gut.
ich habe Hunger	I'm hungry	0	9987aa05d050743d827b7ec5fa634a30	Ich habe großen Hunger, ich habe seit dem Frühstück nichts mehr gegessen, sollen wir essen gehen?	Ich habe Hunger.
ich habe Durst	I'm thirsty	0	ac39ca7c06431e667d6f0cce7911b2ea	Ich habe großen Durst nach diesem langen Spaziergang in der Sonne, ich hätte gerne ein Glas Wasser.	Ich habe Durst.
Prost!	cheers!	0	26c9e356fb10966c6490ac33738f4d73	Prost auf einen wunderbaren Abend mit guten Freunden und einem leckeren Glas Wein!	Prost, zum Wohl!
heute	today	0	0a3ada41c80ef585f0f90c1bbf78a722	Heute ist ein wunderschöner sonniger Tag, perfekt für einen langen Spaziergang im Park.	Heute ist Montag.
morgen	tomorrow	0	9c1b2069a0f6651e03fcd177ad6d0574	Morgen früh fahre ich sehr zeitig zu einer Geschäftsreise nach Italien.	Bis morgen!
gestern	yesterday	0	4af51c1952e2a0dea6520f55f339cea8	Gestern Abend haben wir mit meinen Eltern in einem ausgezeichneten italienischen Restaurant gegessen.	Gestern hat es geregnet.
jetzt	now	0	8176b5e1e09d201d55b9ee5ec4bf0416	Jetzt kann ich nicht reden, ich rufe dich später zurück, wenn ich mehr Zeit habe.	Jetzt gehe ich.
nach rechts	to the right	0	ab9ca9e6a2a3154982fddf56bc166131	Biegen Sie an der nächsten Ampel nach rechts ab und gehen Sie dann geradeaus bis zum Hauptplatz.	Geh nach rechts.
nach links	to the left	0	6eb7ff17374526df2e6917b5ee8c4aaf	Biegen Sie an der nächsten Kreuzung nach links ab und Sie finden den Bahnhof auf der rechten Seite.	Geh nach links.
geradeaus	straight ahead	0	5f5c017fed8b8b2a154dde3c362e2148	Gehen Sie zwei Kilometer geradeaus und Sie finden das Museum nach der Brücke auf der rechten Seite.	Immer geradeaus.
halt!	stop! / halt!	0	a149e198e4773871856915a0f3d1e2ff	Halt sofort an! Du läufst viel zu schnell und könntest auf der nassen Straße schwer stürzen.	Halt, stopp!
offen	open	0	bb256d72c1584e0119360c9228af4705	Das Geschäft ist von neun Uhr morgens bis acht Uhr abends offen, auch sonntags.	Es ist offen.
geschlossen	closed	0	52644124271acc06ad104fc3cff72e27	Das Museum ist montags geschlossen, aber an allen anderen Wochentagen geöffnet.	Es ist geschlossen.
ich liebe dich	I love you	0	67d307c7cb8fdbbfaf362232dc046470	Ich liebe dich von ganzem Herzen und ich möchte den Rest meines Lebens mit dir verbringen.	Ich liebe dich sehr.
willkommen	welcome	0	cd0d2905a7551dc7f9c63f4dde7c5924	Willkommen bei uns zu Hause, wir haben dich schon lange erwartet, setz dich und trink etwas.	Herzlich willkommen!
viel Glück	good luck	0	529ba83b31283880383eea0c02b03894	Viel Glück für deine Prüfung morgen früh, ich bin sicher, dass alles ganz toll laufen wird.	Viel Glück!
