un caractère	a character	1	d99b07e8b322cf230b9004628b110801	Ton chat a un très mauvais caractère.
détruire	to destroy	1	d9bc8360981438f02bb66b8bf3cad512	Leur divorce va détruire la vie de leurs enfants.
civil / civile	civil	1	fb1637415a5148caa49dbd90cea02eb9	Le recyclage est la responsabilité civile de tous.
une liste	a list	1	6a45740d816c2feff4be5cef2316475d	J’ai fait une liste de toutes les choses que je dois acheter pour la fête.
juin	june	1	7e0bab8a08f27e56ee11ab680b1d447d	Annabelle se Marie le vingt-six juin.
un danger	a danger	1	d13ca63337ac31a896d1d3e77fa81d4a	Cet homme est un danger au volant.
complexe	complex	1	252f303ad99526753440459fc32ff243	Cette sculpture m’impressionne avec tous ses détails complexes.
un commerce	a trade	1	85eaa213cb654bff3225254c1963c208	Notre pays encourage le commerce libre et équitable.
le transport	transportation	1	75336a0d1016486446be4929cea9bb9f	Pour l’instant, son vélo est son seul moyen de transport.
une nécessité	a necessity	1	8cfbd6ec41f70b0bf4f4ef3d6d78769e	Tu n’avais pas besoin d’acheter cette robe, ce n’était pas une nécessité.
une institution	an institution	1	c0647185923ec4acca1403ecaa23d018	Mon oncle travaille pour une institution indépendante.
une défense	a defense	1	71349f03c3692f38bc4fc0dbbf3430e2	Pour ma défense, il était déjà trop tard pour faire quoi que ce soit.
janvier	january	1	7a2cf47e44462aa39f3ce1800486ccbc	À Montréal, janvier est normalement le mois le plus froid.
s’échapper	to escape	1	f2fded3dec76a1efe1630c833f340ab8	Il est impossible de s’échapper de cette prison.
une négociation	a negotiation	1	ac7289fdc8eafd234c07e4c5f54ade92	Va mettre la table immédiatement, ce n’est pas une négociation.
une attente	a wait	1	b7edb3b7ababba34ab61147855adceb0	Comment est l’attente à la clinique ce matin?
mai	may	1	85e32da9d23b6c56f1ab3d59fc52160f	Mon dernier examen est le dix-huit mai.
septembre	september	1	1bf0bf09d8b0e3f5dc57e1876e5bf495	Nous serons aux États-Unis pendant tout le mois de septembre.
un environnement	an environment	1	743f4d6fd6660d2ac128e8a96db6aa65	Tout le monde doit lutter pour l’environnement à sa propre manière.
séparer	to separate	1	d563064e560ba8b2d54b43ae3a438119	La partie du bas est facile à séparer du reste.
une réaction	a reaction	1	8598007a39468e47a323e128695d58c3	Explique-toi, parce que je ne comprends pas ta réaction.
franc / franche	frank	1	80e5c54742ce476442e857828329eff5	J’ai besoin d’une femme qui n’a pas peur d’être franche.
positif / positive	positive	1	705c569392536f40fe37f903cf163efc	Les résultats du test étaient positifs.
scientifique	scientific	1	727122e8d0cd09a22b0d20ee13da8338	N’interromps pas mon expérience scientifique!
un papier	a paper	1	cbbfbf4235a0e7aef6b20427bf65eb00	Elle m’a écrit une lettre sur du papier de soie.
une expression	an expression	1	65e4e4e5c1907ba821a10b623f2b4133	Ne le prends pas au sens littéral, ce n’était qu’une expression.
une disposition	a disposition	1	4ef1db5fdcb9fcc75854cf02e5791533	La disposition de cette lampe change complètement le décor.
indépendant / indépendante	independent	1	5e17d96d6a61b31822b963ead60728e1	J’ai beaucoup aimé ce film indépendant.
une carte	a card	1	ed8747e3bce6df6e4ea186c1f6d995ed	Lis la carte avant de déballer le cadeau.
une association	an association	1	65b8725004c6089b4b5820bf9d00d256	Jean est le directeur d’une association américaine.
régler	to fix	1	5114a74c60096ac7874094bd5ad2f2ed	Je ne peux pas régler tes problèmes pour toi.
un modèle	a model	1	6a62b976df678a111af23454b7720a57	Je préfère le modèle de la série A.
une protection	protection	1	041808a92593127d527e4323c8d7f475	Ce cadenas offre une protection assurée contre le vol.
étudier	to study	1	e7cf743c176b46f17db26a28182639df	Je ne peux pas étudier avec tout ce bruit.
déterminer	to determine	1	cb95726dcd5c6f331bf77d1148ee9539	Ont-ils déterminé la cause du décès?
un budget	a budget	1	212e16953e66481d15930dc34f03b49e	Mon budget ne me permet pas de sortir ce soir.
fonder	to found	1	bbd2fcee4e9f59a1866a9f84d623488b	Cette entreprise a été fondée en 1948.
une structure	a structure	1	b7d09b2ad187b594d25aad3ad46c500a	La structure en acier inoxydable est très solide.
commander	to order	1	ef38d2027ea3e86e1a266ca6cb0937a1	J’ai envie de commander de la pizza ce soir.
exercer	to exercise (something)	1	e982abdee7731e7ea612874e6046b529	Je suis assez vieille pour exercer le droit de vote.
un amour	a love	1	7ed37fedabc9999925a931c82e5b8a12	C’était l’amour au premier regard.
manifester	to show	1	7613381ec7918198b2d14a01f1f3c84e	Elle n’a manifesté aucun intérêt envers moi.
menacer	to threaten	1	a3bd5c4ff59d9d1f419595b8beff1d64	Son père a menacé de le mettre à la porte.
conseiller	to advise	1	f6d6953094209dc808d35f134ca1545c	J’ai besoin de plus d’informations pour mieux vous conseiller.
complet / complète	full / complete	1	5e93a25ec7d2aa0105d85ebebb8da977	Désolé, nous sommes complet. Revenez demain.
une opposition	opposition	1	8e5db0215eb492172abfb7216ea66148	Ton déni représente une opposition envers tout ce en quoi je crois.
une maladie	a disease	1	577e5528fddb329a7331738f000de72c	Le médecin a dit que ce n’était pas une maladie contagieuse.
en outre	besides	1	33845f035e7bee19079a8027a37684cb	En outre, il y aura de la pluie mardi matin.
tandis que	while	1	f2a94da6d0b065a9a6f997e32dc889d1	J’irai au supermarché tandis que Pierre sera dans la douche.
la construction	the construction	1	342bd29900e15d880fad4a9f6a31da4d	La construction en bois de cette table la rend durable.
une bande	a strip	1	0114c0419101acd45e577c352bd0a583	La bande d’acier tourne dans le sens horaire.
un signal	a signal	1	d591baf304273f49c2db62ba0f22461b	Attends le signal avant de commencer à courir.
une réunion	a meeting	1	724b5b898f318d32e06ad28fa76cb2eb	Je ne peux pas répondre au téléphone pendant ma réunion.
une réforme	a reform	1	fbbe2cef8beecff45fcab792379d8c74	Beaucoup ne sont pas satisfaits de la réforme de l’orthographe.
rejeter	to reject	1	8f403c33b9b6c362a3f69d753e5778d9	Réfléchis avant de rejeter mon idée.
novembre	november	1	e5a26c1710564470b01c6fd98b78ab9b	Ce groupe sera en tournée pendant tout le mois de novembre.
un fonds	a fund	1	661b2ec3d326e622d2ed3302717b5202	Nous avons créé un fonds pour financer notre nouveau projet.
coûter	to cost	1	16d2e28568b491c15ac625f95007c94a	Je n’ai pas beaucoup d’argent, j’espère que ça ne va pas coûter trop cher.
voisin / voisine	neighbor	1	f092b3a26b76d61d92a36962efe1a28e	Parfois, je prends le thé avec ma voisine.
la presse	the press	1	7a9611f5855cb23ebdadb25c0c9e6bdf	Cette information ne peut pas tomber entre les mains de la presse.
rouge	red	1	814ba269460feae3c33743442c83619c	As-tu vu ma robe rouge? Je ne la trouve pas.
la majorité	the majority	1	ff22711a10441d1f70be41cdb03006c5	La majorité a voté pour le même candidat que l’an dernier.
autoriser	to authorize	1	363a74cddd92d53de5050c1771eede8a	J’ai besoin de votre signature pour autoriser le paiement.
effectuer	to carry out	1	6249e0dc379dff04ef4aa747f9ce290d	Crois-tu que tu pourras effectuer ce travail à temps?
une reprise	a resumption	1	519b0d39c55aadd26975513d22511e2a	Soyez de retour dans quinze minutes pour la reprise du cours.
central / centrale	central	1	1513a0423cfd7b383f09a0eb1c49692a	Ce chandelier est la pièce centrale de la chambre.
une procédure	a procedure	1	f5132401069f8d2893bafbabcb312cd6	Je vais maintenant vous expliquer la procédure.
une faveur	a favor	1	a65645a70e146d2e0e3131a38f2560aa	J’ai une faveur à te demander.
une éducation	an education	1	a5c52ebde70c1c3063ad3c6ee8ed157c	Ton éducation est ce qu’il y a de plus important en ce moment.
officiel / officielle	official	1	c76510db076d4e260fe4f53d7800f4de	Ce document porte le sceau officiel de l’Université.
un document	a document	1	dcd60c839ff202f99d078e3f7b5e5568	Vous devez m’apporter ce document avant demain.
le bord	the edge	1	0d4b922a69c7b6fe0fd2dd5eab8e286d	Ne mange pas si près du bord de la table.
retourner	to return / to go back	1	9d496f0451b8d2fe6c3ffec1408a2248	J’ai adoré le Mexique, j’ai hâte d’y retourner!
professionnel / professionnelle	professional	1	18a2bbb779b82617e9de04de9487fee7	Ce genre de comportement n’est pas professionnel.
un aspect	an aspect	1	faa522f4bf7cab46903b63ece26d701f	Nous n’avons pas eu le temps de parler de tous les aspects du projet.
un animal	an animal	1	b2da849129df2585d2492f91d34d36fb	Le guépard est un animal gracieux.
utile	useful	1	35eb57f77eeccf2c91ad66ad36b09f8a	Ce tournevis est très utile.
s’inscrire	to register / to apply	1	513dc2bb8b519d28420461dbaa65c496	Je veux m’inscrire à un programme d’arts.
la concurrence	the competition	1	0425b2bac6bdf9e0e6354d982bf8c9c8	Nos produits sont plus fiables que ceux de la concurrence.
une déclaration	a declaration	1	d87f1cd6d20009ca522b91bbea2ba0a3	Il a fait sa déclaration devant tout le monde.
auparavant	beforehand	1	d750800cdf41798b946ddf7db7f5e166	Je ne l’avais pas rencontrée auparavant.
mille	one thousand	1	c6c28d01bce2cf5072ec3beb51208756	Elle a dû t’aider au moins mille fois.
absolument	absolutely	1	34ec7741035e02957fe4859f3271674b	Je ne veux absolument pas y aller.
une prison	a prison	1	4bc410808dd7f92b5b11c89104c4f63c	Cette école est comme une prison.
une armée	an army	1	7f48650c4d2d7c433e0eb8e3664501c3	Plusieurs de mes amis sont dans l’armée.
rejoindre	to join	1	e45a74709b0bd5f3ca4aefc85db8ace3	À quelle heure viendras-tu nous rejoindre?
complètement	completely	1	bb4851469d544d109711ac22e5ff9e56	Je refuse, cette idée est complètement inappropriée.
confirmer	to confirm	1	c6d47d73df5ac85d43ba182c30c779b1	N’oublis pas de confirmer ta présence.
un salaire	a salary	1	5cdac7205bfc0708745a4109ca7fe5af	Le salaire de ma femme est plus élevé que le mien.
une lecture	a reading	1	a2df08eb1262e2196c410404dbef08d4	Je ferai une lecture de ce livre devant la classe demain.
un revenu	a revenue	1	c75278386334409203cdddfdc766357c	Ce métier est épuisant, mais il permet un revenu élevé.
attaquer	to attack	1	9eb18a59e7693c61603c0c0bf77af8b2	Vanessa s’est faite attaquer devant chez elle hier soir.
une table	a table	1	0d7078cbe50053f2cc351441efa620af	Je viens d’acheter une nouvelle table d’appoint pour le salon.
remonter	to go back up	1	a0af038e22e7af47eca53b4c662afddc	Je n’ai pas envie de remonter les escaliers, prenons l’ascenceur.
certes	certainly	1	7148f88dcd8b290387b16b05dd4849ba	Certes, il aura beaucoup de travail à faire s’il veut être promu.
contribuer	to contribute	1	5aaf9dc6854caeb5b7105f02bb28c977	J’apprécie beaucoup que tu contribues au projet.
autrement	differently	1	4fb7c69052e991b7093563f6071515b9	À ta place, je ferais les choses autrement.
ferme	firm	1	eca7f662032c0a773a7ebfed024ad8ae	Je déteste dormir sur un matelas qui soit trop ferme.
désormais	from now on	1	560186eead3de72f7bb1ee2f28498d0c	Désormais, je veux que tu m’appelles à dix-neuf heures tous les jours.
lourd / lourde	heavy	1	322040010ac32adfb3047f74f9bc0fa0	J’ai besoin d’aide, c’est trop lourd pour moi.
susciter	to generate	1	da9c6f6ced98482824c9e3b46b1f3670	Son travail a suscité l’intérêt des professionnels.
avril	april	1	1261d8430aa1aa3ce39a56938e63437c	Ma mère revient de son voyage en avril.
dur / dure	hard	1	76c344109d27d77d63f15e840e564712	C’est très dur pour moi de me concentrer en classe.
une application	an application	1	14fb42fd1c35307a05ac02257276f5b6	Je n’ai pas encore reçu ton application.
lutter	to struggle	1	549deca6f6fa35033fc297b449afddfd	Sa mère lutte contre la maladie mentale.
un profit	a profit	1	a081b48707b91d1226db92e84797ff49	Ce projet générera beaucoup de profits.
contenir	to contain	1	d841c7f26c71e9ec810dd9cce0b41384	Cette boîte contient tous mes souvenirs d’enfance.
une république	a republic	1	c3139f9e6b1af42ab8ea6728a31e76b1	Ma grand-mère a quitté la république il y a longtemps.
déposer	to put down	1	11e0bcfb5be8b5077988637d76e2ef1e	Dépose l’argent sur la table et va-t-en.
la communication	communication	1	5d825f6069bbf888d0ac7370b6e99f08	La communication est la clé d’une relation saine.
un jugement	a judgement	1	c420333b4def1e2ed55abebd17981c6a	Cette décision était une erreur de jugement.
un manque	a lack	1	fc9cf3922d0531ebb7411ff9ef2841bc	Il y a un manque de sel dans cette sauce.
modifier	to modify	1	05c77967d2e387b2624dcfef84d65a04	Elle a modifié sa signature.
traverser	to cross	1	b0ece631a7d3cf9922f59f090300f98f	Nous allons traverser la rivière à la nage.
transformer	to transform	1	8d81189fd09cac1ad4b2773620524e6f	Cette chenille va bientôt se transformer en papillon.
un engagement	a commitment	1	e6813b536719d218162857da3e69ca57	Tu dois respecter ton engagement.
un frère	a brother	1	fbdb20288cd0eecbc8cca69c6153d3c7	Le frère de Guillaume a une très belle voiture.
mardi	tuesday	1	800fd7cce5741b550f167a8c270602c0	Je vais t’appeler mardi matin.
un échec	a failure	1	86d4718557177e6ac9d5a2fab0a15165	Cet échec va seulement te rendre plus fort.
un vote	a vote	1	57f563f50629164caacc2c5d5b29ed91	Ce candidat n’aura pas mon vote.
renvoyer	to send back	1	8628396ae092625866d3126865a4fa9d	Je ne crois pas que tu aies reçu mon message, je vais te le renvoyer.
regretter	to regret	1	a4b48f7bcd68d02f71074e4ee550705a	J’ai vécu une belle vie, je n’ai rien à regretter.
une espèce	a species	1	0b0dd4f2358354b1967bba2886f17ccb	Le gorille est une espèce en voie de disparition.
une recommandation	a recommendation	1	e581d6e54a2f5dd29f5384a4fac989f9	Laisse-moi te faire une recommandation.
consister	to consist	1	fa6205d1c15270e96f9232b113c029a0	Ce projet consiste en trois étapes faciles.
une rencontre	a meeting	1	599b5940b3145856fb908fc517c13ce0	J’ai une rencontre avec mon nouveau patron à midi.
surprendre	to surprise	1	116395c968ceac12779ba052db96b58d	J’ai tout essayé pour la surprendre, rien ne fonctionne.
une circonstance	a circumstance	1	c5d2067cb274a804a6359e1f617e1d88	J’aurais voulu te rencontrer dans des circonstances différentes.
un / une témoin	a witness	1	d2b23e217e37bdcdf3a136b82fd69d0c	La police a questionné le témoin de l’accident.
améliorer	to improve	1	b969987d0a351768fe1aad36404a8ae0	Connaître le vocabulaire est essentiel pour améliorer ton français.
une administration	administration	1	84d5632e3a456ed1c1c1ceee57c257ed	Laissez-moi rediriger votre appel au bureau de l’administration.
réagir	to react	1	b3d622bcb3b9e1192e7c022411af85e1	Je ne sais pas comment Rémi va réagir à la nouvelle.
une lumière	a light	1	c0443e1fe55a5dd52eb105eaa53e961a	J’ai besoin d’un peu plus de lumière pour lire.
vert / verte	green	1	e84f9749648783cf00ca8360adb689b6	La lumière est verte, on peut y aller maintenant.
apprécier	to appreciate	1	0c073195f2b436d3f64cb76a8758181c	J’apprécie vraiment tout ce que tu as fait pour moi.
un combat	a fight	1	a432f23c04b83d5d9249d16c61ce13b9	On va au bar pour regarder le combat à la télé.
sensible	sensitive	1	d735c06412ea863754abac66b66d947f	Il pleure tout le temps, il est beaucoup trop sensible.
étudiant / étudiante	student	1	bdbf57edd24f365fc9bd6ff7d2b6d7be	Ma tante est encore étudiante, elle adore apprendre de nouvelles choses.
réfléchir	to reflect	1	38ea325581387a82e658e5da9c60218a	J’ai besoin de temps pour réfléchir à ton commentaire.
malade	sick	1	dfbdaef5f7462409ea1bbac6054f038d	Je suis malade depuis deux semaines.
une portée	a reach	1	190a4c17864cef68d57091b23793b6db	La portée de cette entreprise s’étend sur l’ensemble du marché.
un / une élève	a student	1	e835c7a204cacdd1f9b1b7f80d1e32f4	J’ai vingt-six élèves dans ma classe.
contrôler	to control	1	af5f0d2e4d71a16dfa2861e93dbcfa85	Tu ne peux pas contrôler ses actions, laisse-la faire son travail.
merci	thank you	1	845f1b9811d3f6b0b8b4b119655203ed	Merci beaucoup d’être venus ce soir.
une vitesse	a speed	1	0e2830d006ec4463295b430fc1b9482b	Il a franchi la ligne d’arrivée à une vitesse incroyable.
une visite	a visit	1	650c2fd2035062e77b8841e0725ec8ba	Je vous remercie de votre visite, revenez bientôt!
une assemblée	an assembly	1	574e8c8ac3d2e0e32c90edbc8cb2adb0	Elle a présenté son projet devant l’assemblée.
une émission	an emission	1	a4bcb1414d35b4f3293137863476a040	Ce produit aide à réduire l’émission de gaz à effet de serre.
une arrivée	an arrival	1	403f6f6ab68c9b613010c27f40b0c85f	J’attends ton arrivée depuis un mois.
une puissance	a power	1	60d6db09d9161c75addf7c057639b836	J’ai besoin de plus de puissance pour démarrer la batterie.
certainement	certainly	1	2fe3e28cae5bbd27b2bc8de44470f223	Je ne lui prêterai certainement pas ma voiture.
contenter	to satisfy	1	7da6633a15e6ed4b1ae54eb451ebb9b4	C’est très difficile de le contenter.
une perte	a loss	1	a3e684ae16585bc886e28da515bbfd47	Ne pleure pas à cause de cette perte, tout ira mieux demain.
libéral / libérale	liberal	1	b18a53eb9d73913fbc64766a65fd52d8	Yvon a voté pour le gouvernement libéral.
citoyen / citoyenne	citizen	1	e39bde6ae6309f19f48333ab67a9d728	Je vis aux États-Unis, mais je suis aussi une citoyenne canadienne.
citer	to cite / to quote	1	84d3bc1af4b25a59ed530fa3a42bd1df	J’ai fini ma dissertation, je dois maintenant citer mes sources.
un / une partenaire	a partner	1	de9c219491ea999b9b13a279fd37f203	Vous aurez besoin d’un partenaire pour faire ce travail.
un camp	a camp	1	f5e32e025f4f16adc39eb169950adcff	Ma fille passera l’été au camp musical.
un établissement	an institution / an establishment	1	09d6474c1e5bac510b5017484b5e9e77	L’établissement de la loi 101 a été réalisé dans cet établissement.
vendredi	friday	1	f450176bc9f0640557a9c91e31b10d2e	Vendredi est mon jour de congé.
une avance	an advance	1	dce0ef72ed7b81fc8652686f11861f67	J’ai besoin d’une avance; peux-tu me payer aujourd’hui?
destiner	to intend	1	7639f01d52649723b8ed3d43159abe36	Cet ensemble de patio est destiné pour une utilisation à l’extérieur.
une influence	an influence	1	74b1a095ebbe5569d16ca28b94b6e983	Cette musique a une mauvaise influence sur ton comportement.
nord	north	1	189a63c72729d2f470d4219b0ef11345	J’habite au nord du pays.
lundi	monday	1	b23a0e06d2914a663f991800e8498017	Qu’est-ce que tu fais lundi?
un maître	a master	1	fa57171d3354f796573fe48cf18a3702	William est un maître de la cuisine.
interroger	to interrogate	1	fe8be3a4295f15d4e1e1632a53254513	La cour est sur le point d’interroger l’accusé.
une conférence	a conference	1	0c070c66b7052d59a523880e6d099be4	Je suis allée à une conférence très intéressante ce weekend.
causer	to cause	1	65c6bdd630377a9068c49ce982f82c9d	Qu’est-ce qui aurait pu causer autant de dommage?
une vente	a sale	1	93fcb2241e68591a412844d0b43e1420	Cette robe est en vente, je crois que je vais l’acheter.
ramener	to bring back	1	34eb47368972234c730d3fee83596e6b	Pourrais-tu me ramener le marteau que je t’ai prêté?
soldat / soldate	soldier	1	ddcbeefa3c8513404f6940988fa3859b	Ce soldat mérite la médaille d’honneur.
un / une collègue	a colleague	1	88e0c3d2eb0e0ff0b4ba34c8a70b61cb	Laurence est la collègue de travail avec laquelle je m’entends le mieux.
provoquer	to provoke	1	e28729382d09798ad510345b56cbb226	Arrête de me provoquer si tu ne veux pas que je me fâche.
concevoir	to conceive	1	9f2d3001a834bee174e206c71c8664cd	Il est difficile de concevoir une telle chose, je suis impressionné.
un poids	a weight	1	33b96b6f1acf89445657a8ed0c19e8a7	Ce poids est trop lourd pour moi.
voici	this is	1	3ac8323efa13a89f36581eebacbf84ef	Voici ma voisine Carole.
acquérir	to acquire	1	52510e996b20fde56b4a439de9be1b19	Elle a acquis de nombreux talents grâce à ses études.
le / la moindre	the slightest	1	150203d7aef54392a6372764d8be2901	Je n’en ai pas la moindre idée.
convenir	to be suitable	1	ce7291d591c8998f6ff2390585313e86	Ta tenue ne conviendra pas pour le dîner de ce soir.
procéder	to proceed	1	7caaa8aede8cdcf289badc557cb0932c	Il y a deux différentes manières de procéder.
examiner	to examine	1	38279d6e18659196e5eec1f80bc6fc9e	Le médecin est prêt à examiner le corps de la victime.
un soin	a care	1	2ddefd7488551fa66137c24d06d96e29	Ne t’en fais pas, je vais bien prendre soin de toi.
mesurer	to measure	1	38440331b2cce0fe16526ec021eb45e4	Mon amour pour toi ne peut pas être mesuré.
un traitement	a treatment	1	7bfed1fe3695346be1040a6cfca3cd6e	Le traitement des données prendra huit heures.
jeudi	thursday	1	5363dd01a4b739683f0cedcc5445a548	Je finis de travailler tôt ce jeudi.
impliquer	to imply / to implicate	1	7cd2e98b2d1a5df913a2be04e609a088	Cela implique que Marie était impliquée sans le savoir.
une logique	logic	1	5a9caed378f70b19b1a4ad5160e599fe	La logique peut vous aider à résoudre ce problème mathématique.
un individu	an individual	1	ca5b3016ed6526ace9e9c578f25209e2	Chaque individu est libre de faire ses propres choix.
une donnée	a datum	1	cfe060d377a679ce068faf6c58eafd92	Je n’ai pas eu le temps de sauvegarder mes données!
demi / demie	half	1	84c9351232f7679ba0f810d6bea69d95	Rejoins-moi à l’aéroport dans une heure et demie.
combattre	to fight	1	65a09cefb9dd4b92c89e7926debd120f	George a créé un organisme pour combattre la pauvreté dans son quartier.
violent / violente	violent	1	cec61a1f9d2a7e492e5a38c734e3c303	Francis devient violent quand il boit.
une science	a science	1	17f275809aed8c80b4bb7400c20a7a57	Ce n’est pas une science exacte, mais ça devrait marcher.
suivant / suivante	next	1	25df5d9cb6ff4437067c4a2c2780a598	Benoît est le suivant, ensuite c’est ton tour.
mériter	to deserve	1	2c56a87950e9c43d8a449f121dc8d95e	Tu as eu ce que tu méritais.
emprunter	to borrow	1	96a92518598dfc801e0c3d7ab8ece144	Est-ce que je peux emprunter la voiture ce soir?
une conscience	a conscience	1	5fdc0730032becf04a02ba9afea469fc	Anne n’a aucune conscience sociale.
comporter	to comprise of	1	412469749714b024b086f89652def89a	L’ensemble comporte une table et quatre chaises.
le sang	the blood	1	a6cf9638ec620693ecfd80e29eba6b65	Il y a un taux élevé de glucose dans son sang.
un millier	a thousand	1	5ada240f945f9a9dade30f177591dc97	Il devait y avoir au moins un millier de personnes.
emporter	to carry away	1	6dee5e4dd23a66c01c33ec7fb5a2be6e	Tu vas te faire emporter par le courant.
une initiative	an initiative	1	c90a19a131bb1714766a6431d6e8168d	C’était une bonne initiative de sa part.
nucléaire	nuclear	1	0a44c46d54f0d018d1d89d9e8b34ec0c	Les armes nucléaires n’auraient jamais dûes être inventées.
traduire	to translate	1	92b27e9c1593905bcd9653d392bf9a4f	J’ai besoin de ton aide pour traduire ce paragraphe.
vif / vive	lively	1	48703dcca7728c4f7a298e5a06682115	Les couleurs vives de ce tapis attireront définitivement l’attention.
exact / exacte	exact	1	2f69bce4c3ee7efed99149c4e101de69	Rejoins-moi à cet endroit exact.
une exception	an exception	1	f26bdbcec46a3287206cd23f48d28b87	Êtes-vous sûr de ne pas pouvoir faire une exception?
doubler	to double	1	91fa8cda7defbfd31a97bbe3fe37e8f6	Ça y est, je double ma mise!
février	february	1	7ff963b9344262c5d584b184f8e5b5fd	Il fait encore très froid en février.
un mode	a mode	1	d465b5bb3efe719e559000eaad770585	Mets ton téléphone en mode avion.
industriel / industrielle	industrial	1	9d4acb057c9a0418ff1686c1ec7a19b9	Yannick adore la musique industrielle.
la musique	the music	1	76a5823c199d75518b5c9e8d93d9ea15	Je ne sais pas ce que je ferais sans musique.
la gestion	management	1	e6dcbf81ccab732a1751fffc8ece10cc	Xavier étudie la gestion financière.
un honneur	an honor	1	869aa3bf1af38127fab531623ade2c19	Ce serait un véritable honneur pour moi de t’accompagner.
vaste	vast	1	c45d75d8ae361220720e75a19c671e3d	Mon arrière-grand-père possédait une vaste terre.
évoquer	to evoke	1	19ed74a0209a991ec181398a97a828ea	Ce film a évoqué beaucoup de mauvais souvenirs.
tendre	to stretch	1	f61d70fe6343853d93bb422461dc7ceb	Nous allons devoir tendre la corde encore plus que ça.
une étape	a step	1	fb0afb020a125b642eb049e36a4cc9ea	Tu dois suivre les étapes dans l’ordre.
physique	physical	1	1cc03249a5b639478f353e075ad9eb1d	La douleur n’est pas seulement psychologique, elle est aussi physique.
accuser	to accuse	1	d26407b92be2b36c6aa4302e727e3c86	Tu ne peux pas m’accuser sans preuve.
parfaitement	perfectly	1	b037b4b88b5effb8cedcde9cb0c33d53	Ma voiture fonctionne parfaitement depuis que le mécanicien l’a réparée.
une méthode	a method	1	27441ba27086980305f5bcc8f257cf37	Quelle méthode as-tu utilisée pour accomplir cette tâche?
fonctionner	to work	1	91ab2d66f2612787768a4095223a761c	J’ai besoin d’aide, mon ordinateur ne fonctionne plus.
envers	towards	1	fccb006268befffa72dc934f0c3274a6	Ton attitude envers moi est inacceptable.
distribuer	to distribute	1	cb0549bff6cc3b758c32557f20d6f965	Cette entreprise distribue des produits à travers le monde entier.
une existence	an existence	1	da23103cbb781a158ad14bf9c3e0a20b	Je n’avais jamais entendu parler de son existence.
prétendre	to pretend	1	a3a2de1c77ce472a20964b1b14ae5acd	Il prétend être quelqu’un d’autre et c’est pathétique.
global / globale	global	1	4cb4def04af5a10bc42072d29db6d451	Cette couleur augmente l’attrait global de la pièce.
un / une professeur	a professor	1	7d30aa26580eb0c1c15b37f691cad024	Il faut de nombreuses années d’études pour devenir professeur.
le crédit	the credit	1	4d0ffcff7632ad8e963a2a2ab6a7826e	Le gagnant aura le crédit qu’il mérite.
une tendance	a tendency	1	d560370262cbc00bb80f1b6d18e6ab80	Martine a tendance à conduire trop vite.
une chaîne	a chain	1	5af8a7acf13019156a4e0e6e6e945bd0	Il m’a acheté une chaîne en or délicate pour mon anniversaire.
un dommage	damage	1	f07a47f05c6fc096a26b2bf919ef00f1	Tu devras certainement payer pour les dommages.
une note	a note / a grade	1	913c806f68487e74cce96c413a876365	J’ai écrit une note au bas de la page qui explique comment vos notes ont été calculées.
