supporter	to support	1	aa7a48cd42f3c4e8794d35c9a436d5ce	Je serai toujours là pour te supporter.
une catégorie	a category	1	f5742181ffa79ae90f7c874808f81f07	Vous devez choisir trois éléments dans cette catégorie.
une mine	a mine	1	8a111a16288d1cdc7e98def212da1268	Victor est ingénieur, il travaille dans une mine.
législatif / législative	legislative	1	f6a864aea64c8c035d95adb44a11bf78	Ils nous ont assuré que le processus législatif serait respecté.
le / la propriétaire	the owner	1	be6dbbc404ba7f44f7969090fa216ad4	Le propriétaire de l’immeuble qui est responsable de l’entretien.
favoriser	to favor	1	eb8a668873f6dc9aa678bb335e14e234	Cette décision a été prise pour favoriser l’équipe.
privé / privée	private	1	b0fd8b49affc5f78f9a650aaf6ab2f2d	Allez-vous-en, ceci est une propriété privée!
un avion	a plane	1	6ad640f83a3ffc10bdbc9e2df3c08d71	Je suis toujours malade dans l’avion.
minimum	minimum	1	310042eb8a4c97608ca27013ef7dcc01	Faites le minimum de bruit possible, j’essaie de dormir.
criminel / criminelle	criminal	1	5181d46aff6c89a3f8a58342e3cbbe23	Ils ont finalement arrêté ce criminel dangereux.
une photo	a photo	1	cd1b63e6f746922b2c96253849d968da	Je garde cette photo de lui dans mon portefeuille.
précéder	to precede	1	1d2606d732708decad9e1fbbc904b95d	Le juge a complètement ignoré les événements qui avaient précédé.
solide	solid	1	1295e6d07461d592bc7d44f29447b160	Ses arguments ne sont pas très solides.
une priorité	a priority	1	7cdf3f678d7410e6ef778e86b6daec9d	Les piétons ont la priorité.
un navire	a ship	1	4ba91be7c28a42c306fd22abf9c39bde	J’aurais aimé voir les anciens navires français.
une centaine	a hundred	1	bc22bdcd99b95c3c550a1c246917bd37	Il devait y avoir une centaine de personnes à la fête hier soir!
une explication	an explanation	1	e0ff4f68b58a28df277ca3cdb3bbfa04	Pourquoi as-tu fait ça? J’attends une explication.
transmettre	to transmit	1	e300770afdcb9110b1c0891600aa1805	Merci, mais j’ai déjà transmis une requête à l’administrateur.
un appareil	a device	1	cdbe6516bfcc62d3d1055a5613998e91	L’appreil doit être placé à six pieds du mur.
correspondre	to correspond	1	3908c626fec1527522b91b37deea1761	Le sujet de votre projet doit correspondre à ce dont nous avons parlé hier.
associer	to associate	1	99571e1f2e8cdc792431c30dd58a0403	Il est associé à l’une des plus grandes entreprises d’Europe.
un trait	a trait	1	3f0140a10fdfeac68650d8830af5129e	Elle est très drôle, je trouve ce trait charmant.
une référence	a reference	1	b8c6c3c3a2ab4f049a81e88d789ce406	Ce film faisait une référence aux Jeux Olympiques.
le bois	the wood	1	87fdfe4d81b606cf91bdfe872417c3a9	Cette table en bois de pin est magnifique.
une publication	a publication	1	ffc1cd98c60dd676b11fff160fd483a6	Il a été forcé de supprimer sa publication blessante.
un symbole	a symbol	1	35ff866f34bb622cfd075a057ef3f82a	Cette bague est un symbole de notre amour.
la consommation	the consumption	1	79c24f675bc246af232f3c3eaf67c6ab	La consommation de breuvages alcoolisés est interdite sur la terrasse.
idéal / idéale	ideal	1	52485a280de137c06bd242851d948364	Cet endroit est idéal pour nos vacances d’été.
le chômage	unemployment	1	c5c6a6a8cd23128486f63956646b50b0	Le taux de chômage a encore augmenté cette année.
le courage	the courage	1	21214b6dc0fbaf81d2b994912d69a16f	Je n’ai pas le courage de lui parler.
identifier	to identify	1	073eafd329430aad817e5f0f835746fc	Pouvez-vous identifier votre agresseur parmi ces quatre individus?
un entretien	an interview / maintenance	1	3671c90e631ad3a9bb26886a79bc24f1	Eugène a un entretien d’embauche pour devenir préposé à l’entretien.
encourager	to encourage	1	5bd2a1d20efec2741daf7d04fb638ee2	Merci de m’encourager, c’est très apprécié.
un kilomètre	a kilometer	1	c5840cdf32a0be00613f065554976d58	Il est parti travailler à des milliers de kilomètres de sa ville natale.
dérouler	to unroll	1	4a53009d8314f84d9497baa897b84f7a	Aide-moi à dérouler le tapis, nous allons le placer dans ta chambre.
une identité	an identity	1	1582392cbe64e0c368ceb137ef72d8f3	L’identité du meurtrier n’a pas encore été découverte.
la reconnaissance	recognition	1	d1be559e747174346c60fdef9386958b	Tout son travail lui a apporté beaucoup de reconnaissance.
signaler	to report	1	2616b5fe488b4b3acae622fd9744c378	Elle est allée signaler l’incident au garde de sécurité.
une division	a division	1	fc18e805fe3324e8dd61ddb6cf32cea8	J’ai entendu dire qu’il travaillait pour une division du gouvernement.
un contexte	a context	1	4d7f5efcd88612654df1751ab5a4bbc6	Ce mot est plus facile à comprendre en contexte.
coupable	guilty	1	99579c9fac4e4514d7c3694c306a982c	Il est coupable d’avoir volé des cigarettes derrière le comptoir.
favorable	favorable	1	bdba1a2e24f127b1af76c390222463bf	Nous irons au parc quand la météo sera plus favorable.
un amendement	an amendment	1	4b6634593093b1ac4bf023997d99b7e2	Trois des députés sont en faveur de cet amendement.
août	august	1	95ec2dd77761c66a5176528fa438a428	Il reviendra de voyage le sept août.
attribuer	to attribute	1	d8d38ac47f354f7bb840e6042897fc15	Tu ne peux pas lui attribuer tout le mérite.
courir	to run	1	75ca4d8c81aa8615542d3e7139864f42	Cours, ou tu manqueras l’autobus!
un examen	an exam	1	c76d3a9ca0ceb236e78a82d152641c80	Il ne me reste plus qu’un examen, puis c’est les vacances.
un personnage	a character	1	aa9c28371bd0651871252dc16dea7938	Sharon est mon personnage favori dans cette série télé.
une obligation	an obligation	1	9bacb32da05301966fb75239b89c4602	Vous devez signer le document, c’est une obligation.
inconnu / inconnue	unknown	1	7c3b0fd49ddf4c34db41b8535150058e	Nous nous sommes retrouvés sur un territoire inconnu.
échanger	to exchange	1	1cd4ef70f55e583e759818de76143855	Je vous appellerai ce soir pour échanger quelques mots.
un montant	an amount	1	483f2501981b44151c2c451d50d4f45b	Le montant d’argent nécessaire est trop élevé pour moi.
éliminer	to eliminate	1	2b712abec3cdca6bce0925a13a67ae15	Nous travaillons fort pour éliminer toutes vos inquiétudes.
dénoncer	to denounce	1	eaf801eeef408879ca5fa634a8d3a853	Cette injustice doit être dénoncée.
un tableau	a board	1	70b63e192fad53cfdcdab713254ff722	Certaines clases ont encore un tableau noir.
exclure	to exclude	1	6d8b2c098a6601edaa6c26dfa07b0ebb	Nous ne pouvons pas exclure la possibilité qu’il arrive en retard.
un meurtre	a murder	1	41e017df923c0f2689359cb8484657a7	Le meurtre a été commis pendant la nuit.
un exemplaire	a copy	1	d770f1285c863702442719d1764e8289	Je vais lui demander de signer mon exemplaire de son livre.
une propriété	a property	1	ed6a34c90d4ce938c63d6e3f5a9070a2	Cette terre est la propriété de ma famille depuis des centaines d’années.
final / finale	final	1	f05903be924103bb973763f8436321d7	Je ne suis pas encore prêt à remettre la version finale.
un site	a site	1	9b2ef672ac63d4d6a9846625f02afee7	Des clôtures nous empêchent d’entrer sur le site.
une séance	a session	1	ccf44f5b4760c6f1ebad93a340264469	On se revoit dans une semaine pour la prochaine séance.
une ouverture	an opening	1	abb0a3d833c2305dc4063101bee482e4	Il y a une ouverture au bas de la cannette.
élire	to elect	1	fa25cd95ee973899fe86ea5a3faa9ad0	Nous avons le pouvoir d’élire nos représentants.
une baisse	a drop	1	baa8f02a89a028177fcf5fdbe68ac2f6	Les profits ont subi une baisse importante cette année.
une inquiétude	a concern	1	fdae4fdfa2b9dceb30843505655a9e19	Nous nous occuperons de faire disparaître vos inquiétudes.
israélien / israélienne	israeli	1	14018fdc14573e3f8c1daf0bac0855bf	Le représentant israélien fera un discours cet après-midi.
une représentation	a representation	1	5c97995e030af9856c27a65034f5bd06	Nous irons voir la représentation de vingt heures au cinéma.
une durée	a duration	1	670f62902a0daf7ad4e2c64105e4df6b	Vous devez respecter cette règle pendant toute la durée du contrat.
un mandat	a mandate	1	a527c562fbfe9aaaa43997f66fe55c85	Cet engagement fait partie de notre mandat.
quinze	fifteen	1	242e50470ddca75984afce72bc9ba8d6	Tiens bon, il ne te reste que quinze minutes de classe.
vide	empty	1	26f5205ec88ac076a075b69c4404d8c5	Comment se fait-il que la bouteille soit déjà vide?
un statut	a status	1	547cd7b28bb8baad4667708b9e4f9bc4	J’ignore quel est son statut matrimonial.
un essai	a try	1	9da97efdb821ac315ade0628c5dc3f68	Devine la nouvelle, tu as droit à trois essais!
pareil / pareille	the same	1	26677f61881e98b146bccdb463055306	Ce collier est pareil à celui que ma mère m’a acheté.
italien / italienne	italian	1	48fb24a8c550f0571648bab00809a457	J’adore ce restaurant italien.
suggérer	to suggest	1	bd2706aa65b2a515dadda0385644969f	Appelle-moi ce soir, j’ai quelque chose à te suggérer.
interrompre	to interrupt	1	5858a147ef706e23eb49691399f609a7	Ce processus pourrait interrompre le transfert des données.
au-dessus	above	1	14f42bda707348b834b5a9bf9a4554b6	J’ai placé l’urne sur une tablette au-dessus de la cheminée.
une agence	an agency	1	c8fa433451e3421ebcfa492890f35f44	Je travaille pour une agence de recherche.
une usine	a factory	1	0e619c502a2626e72b4ebef7ffcb9b16	Ce produit est fabriqué par nos experts directement dans l’usine.
unir	to unite	1	20c155d0d6cc0fa7ba14d6abf8e427d2	Nous devons nous unir contre cette injustice.
sourire	to smile	1	1524fa116f2e4acfb42b56ea52ae10d5	Elle ne sourit sur aucune de ses photos.
employé / employée	employee	1	5c234fc2ffb09a82f231823b4b72eced	Il mérite le titre d’employé du mois.
un sommet	a summit	1	c8ceedaf5a6d4c58a62dd6a7f79364d5	Nous prendrons une pause une fois arrivés au sommet.
franchir	to overcome	1	028e890150a69338451b1f468b03884f	J’ai besoin d’aide pour franchir cet obstacle.
évident / évidente	obvious	1	914485978ed2c346e4468e5b9b2bc38d	Malgré son sourire, sa souffrance est évidente.
un comportement	a behavior	1	f15f96b5abd8192366d80bf1ab82877a	Son comportement a changé.
une fête	a party	1	33925c0c0e6fcaef788c9334c3670378	Pourquoi n’es-tu pas venu à la fête hier soir?
un rang	a rank	1	6b99129ccea2248e7f277427c07d1457	Il peut faire ce qu’il veut, son rang social le lui permet.
écarter	to keep away	1	4e1024a8793a48dcd0bbb398294166f5	Écarte cette feuille de papier de la chandelle.
une vague	a wave	1	ba5dce609132176d84fb8d54d4313759	Il s’est fait emporter par les vagues.
une réduction	a reduction	1	aba0e485ef38e9dd9f2ef2f338730c48	Ce magasin offre une réduction de vingt pourcents pour une durée limitée!
culturel / culturelle	cultural	1	7f412139ce88347441b340256fe65abb	Nous devons résoudre ce conflit culturel.
la coopération	cooperation	1	e7a34e82880bdbf2801c7485eb996458	Je vous remercie de votre collaboration.
le sol	the floor	1	a245d0eb3184e65007b62b9c353fed03	Pas de chien à table, il mangera sur le sol!
une taille	a size	1	6c1aa72b59deb5a6b33d0ff0ee9c1720	Cette robe est magnifique, j’espère qu’ils ont ma taille.
une vertu	a virtue	1	dd42a9958567afcb01ecd08c587012da	La patience est une vertu.
une distance	a distance	1	844ee98b6e10c7573162a60b8638918a	La distance qu’il y a entre nous est insupportable.
un automne	autumn	1	563178b6fe0451066e8952a5b2ad7c40	L’automne est ma saison favorite.
un arrière	a back side	1	76173a6025e554a5477a275f8c8a534a	La prise de courant est située à l’arrière de l’appareil.
une vision	a vision	1	e14a880b04ccf07e18d39f8b3a6efb24	Elle a eu une vision qui prédisait cet événement.
investir	to invest	1	b0823b09662eb182eb902a1959bd4b96	Cette année, j’ai choisi d’investir dans une nouvelle voiture.
diminuer	to decrease	1	dcaa83918742d49b7e4f0d9c5282f4f0	Les revenus de cette entreprise ont diminué depuis l’an dernier.
un contenu	contents	1	53d88db7bd256389fc438751d54fccfd	Cette boîte et son contenu m’appartiennent.
entourer	to surround	1	31031c9ff56223b5f0e0f93b59df2c2c	La mer entoure cette île.
juif / juive	jewish	1	c5808f41801ea668bb657d437a6b60b5	Sa voiture est tombée en panne dans le quartier juif.
considérable	considerable	1	292325b2ad7d32d0458b1bd2fbea2e3c	Ceci est une somme considérable, laissez-moi y penser.
une conduite	a conduct	1	131fa6f9799bd509c111a7f5dc8d2f14	Vous devez respecter chaque élément du code de conduite.
une convention	a convention	1	ed6f0a6730568f499726c3741ca7a429	La convention aura lieu au Palais des Congrès de Montréal.
se réfugier	to take refuge	1	98dd3348580ec5f83e546aa3071b6b87	Il est allé se réfugier au sous-sol pendant l’attaque.
prolonger	to extend	1	d9789b994b947ed23d91a8a686f6bfd2	Son nouvel argument a prolongé le débat.
verser	to pour	1	81ee1d8a52ba625ecd99af6d523683d2	Tu as versé trop de bière dans mon verre!
une évidence	obvious	1	4fd21cdcecad799fb13f90038f314c70	C’est une évidence et ça ne peut être contesté.
essentiellement	essentially	1	11c3fbe99e4f88bf9db9068563f7da72	Essentiellement, nous vous demandons de fournir une pièce d’identité.
démontrer	to demonstrate	1	687e53a168e30333b6fae79ffe7d76ce	Ce rapport démontre que la réaction chimique libère de l’énergie.
communiquer	to communicate	1	46e40ea70b4331792bea296113637938	Notre relation est en péril, parce que nous ne communiquons pas assez.
une approche	an approach	1	a3258e901aaa44efaca6f8162535d286	Il a choisi une approche plus humanitaire.
un délai	a delay	1	16080b46c6163435bdf12a2f4208cf43	Il y a eu un délai, je vais être en retard.
accroître	to increase	1	23d234137900b1adbfce8fd9864c59ea	Nous espérons accroître la qualité de nos produits de manière significative.
un bruit	a noise	1	d27776dbc13f2498f7f66dd92c225e6d	J’ai entendu un bruit… qui est là?
une humanité	humanity	1	1fae448d3c5a92753a2d442fa3ddeb39	L’humanité est égoïste, les choses ne changeront jamais.
la radio	the radio	1	fd6e87e029f5f85b82069c7d18a231cd	J’ai entendu une nouvelle chanson à la radio.
moi-même	myself	1	edb078f098f594511858705cbc6b829d	Si je veux que les choses soient bien faites, je dois les faire moi-même.
négatif / négative	negative	1	a40c8986a14e8221d84941c121ed5bb0	Je ne peux plus tolérer son attitude négative.
prudent / prudente	careful	1	3e4d941cc7ac0e817ae703f4a007f2f2	Sois prudent ou tu vas te blesser.
la soirée	the evening	1	6c408010b139680d3468237d8106fe46	J’ai passé une merveilleuse soirée avec Bernard.
un vol	a flight / a theft	1	3208fc81b0050716f8d8f2ba3a970356	Le vol de son portefeuille a dû se produire pendant son vol vers Paris.
marcher	to walk	1	79632f4bb950fa5c234f3228b627f818	Ce n’est pas loin, on peut marcher jusque là.
un tiers	a third	1	1cd2ea3d6be81ad6c6a542740dd1c61d	Elle a déjà complété un tiers de son travail.
un mètre	a meter	1	df7188d8fb808206b12094b4aae3157d	Le prochain arrêt est dans trois cents mètres.
un syndicat	a union	1	d927200fe6eaa61779df8d65be389b75	Le syndicat des travailleurs sera bientôt en grève.
occidental / occidentale	western	1	3c09574152ceb8ba48c25908572a1796	Patrick préfère la cuisine occidentale.
suffisant / suffisante	sufficient	1	277157c434dd6693f71be7bcc84c7b8b	Cette preuve n’est pas suffisante pour l’accuser.
le ciel	the sky	1	676d0783db504e6165559b2dbb157bdd	Le ciel est gris, je crois qu’il va pleuvoir.
tromper	to deceive	1	050bfff3116ed06439f1bc9db1cd0cfd	Il a trouvé un moyen de tromper son adversaire.
modeste	modest	1	b239014d29c180e8ca5fd2e48838a0fd	Bienvenue dans notre modeste demeure!
éloigner	to move away	1	d12fa942f1d2bd7aa5a0a43c5ce776c0	Éloigne ton assiette du rebord de la table.
aborder	to approach	1	41688766bc5702c0e0a849875adc3558	Il m’a abordée pour une offre d’emploi intéressante.
malheureusement	unfortunately	1	052cd8edb1c99b1687dbfa7b87f7518d	Malheureusement, il n’a pas survécu l’accident.
évaluer	to evaluate	1	d2a984b74ca524bc4cfee727c73c1b9f	Nous devons d’abord évaluer la situation.
extrêmement	extremely	1	c227785193dd23f67c1906fc519b96c7	Cette ballerine est extrêmement gracieuse.
interne	internal	1	a80b8f4abb11f309ed875de9f212be93	Elle a subi une hémorragie interne.
voire même	even	1	1075175f1f1ef9a46336149771703589	Elle pourrait quitter le cours, voire même quitter le programme.
une seconde	a second	1	1d2b4fa0ee829c169f0ef4f4a3c2467d	J’ai jamais pensé à ça, même pas pendant une seconde.
des messieurs	gentlemen	1	91585db2bae9d8aed6ea57d70ec1233d	Veuillez accompagner ces messieurs à leur chambre.
effectivement	effectively	1	380cd3e70ce765bb2e7b00ea7be2f79e	Effectivement, j’avais déjà remarqué.
un gaz	a gas	1	a4dd14b26dd61b774a378716bebc2c01	L’azote est un gaz qui est présent dans l’atmosphère.
acteur / actrice	actor	1	9b39a437ebfa376968a66def19263692	Mon acteur favori a remporté un Oscar l’an dernier.
s’adapter	to adapt	1	14e85d98a5127d6def00a5c936d084d1	La nature trouve toujours un moyen de s’adapter.
un témoignage	a testimony	1	50294ce678e66d20be59571f61345e15	Le juge n’a pas cru son témoignage.
une dépense	an expense	1	1d314ee530c4b37c8ade71681ad5e3a5	Je ne suis pas fier de toi, cette dépense était loin d’être nécessaire.
un souci	a worry	1	475506d905dcbc5997b955db4a4726e1	Pas de soucis, je m’en occupe.
expert / experte	expert	1	96b68f878910241ce2221a1e518e2416	Vincent est un expert de la mécanique.
une sœur	a sister	1	27965d3b986a9c47b6a020ebb1fd0659	Ma sœur et moi avons beaucoup en commun.
relativement	relatively	1	bbd9cc888c2a5e99e65609ff3e8ba18f	Il est relativement grand pour son âge.
comparer	to compare	1	3c13f882edeb6d8635003fdfe5443e59	Tu ne peux pas comparer ces deux choses, elles sont trop différentes.
une cour	a yard	1	3b4adf003f262f77dc9df151d60ef683	Nous avons fait un feu dans la cour.
provenir	to be from / to come from	1	62fbb0a11fe0303261bceab0f819a59a	Cette montre provient d’Italie.
réellement	really	1	d7c9eeeb2f27b47de05b5d282ab1db6f	Je ne mens pas, j’ai réellement envie de te parler.
conscient / consciente	conscious	1	9d3bd29e316b709e766d2b47fdee5796	Le médecin a dit qu’elle était consciente, nous pouvons aller la voir.
céder	to give up	1	7315eed588f75ce3c72032da54a0b89e	Elle avait fait du progrès, mais elle a fini par céder.
médical / médicale	medical	1	1cf464ad80ee3e17209a21ff2ca859e4	Elle ne viendra pas à la rencontre pour des raisons médicales.
un procès	a trial	1	d052997bbc7db9447a2509962d50b820	Avec cet avocat, nous sommes certains de gagner le procès.
la colère	anger	1	e11f4141f2706b8f4e3233627cfbb353	Tu dois te défaire de toute cette colère.
patient / patiente	patient	1	8e6c9b4c2a3d204b8688688620719b6a	Ce patient a été très patient d’attendre six heures pour les résultats.
une notion	a notion	1	9dda7878ebed2147873a6f6adfdbd516	Cette notion lui est complètement inconnue.
un siège	a seat	1	e8abac276886369a3da92a8cc7b39f26	Il y a des sièges en cuir dans sa voiture.
une hausse	an increase	1	1adb2562bd91ca47f417809093bd03a1	Le gouvernement a annoncé une hausse du salaire minimum.
diviser	to divide	1	c2a8d288ab43e65b743c8a82bfb0e1c4	Nous devons diviser les ressources de manière plus équilibrée.
traditionnel / traditionnelle	traditional	1	38281744b61c5c226770327b59edf609	Ceci est une coutume traditionnelle en France.
un quart	a quarter	1	92781ad4f4d57fcab9166c4dbb54b84d	Nous auront chacun un quart du trésor.
approcher	to approach	1	2071d429ac71d270586919c6baa0e94c	Le léopard approche lentement sa proie.
le trafic	the traffic	1	74457c3a0491a58f0d1edab5acade42d	Je suis prise dans le trafic depuis une heure.
catholique	catholic	1	6a280605622a551d69473ed8e2521acc	Je suis allée à l’école catholique.
un mécanisme	a mechanism	1	413fd93e1a003de4d2d249a2af47c701	Je ne comprends pas comment fonctionne ce mécanisme.
un / une adulte	an adult	1	45de98811f9241211a5c3446361aa377	Maryse est une adulte responsable, elle saura quoi faire.
reprocher	to reproach	1	7812a99860a24b082b3374b1abd8b1c3	Mon père me reproche toujours de me lever trop tard.
un métier	a job	1	a67aae4e619b9c8e4b0bf8ea40b8ef14	J’ai ce métier depuis cinq ans.
une modification	a modification	1	ae77531d38dafbd45527326c6d0212ee	La modification peut seulement être complétée par téléphone.
peser	to weigh	1	56a45f61cdf9020fb9bf15f80bd44792	Il pesait deux cent trente livres l’an dernier.
les médias	the media	1	acfee50b542b73e029ce346badc597a8	Les médias ne doivent pas entendre parler de cette histoire.
un foyer	a home	1	e88c6cd5ed5a7464b18969bd94adc112	Votre foyer est si accueillant.
une définition	a definition	1	93ab0c74eb5c49206327491025ff1154	Tu trouveras la définition de ce mot dans le dictionnaire.
un / une spécialiste	a specialist	1	59b85f5fee2fecfc8da3d8709f6ff252	Joseph est un spécialiste de l’électronique.
un mari	a husband	1	9c0b224c73061ebca116269b527fbbee	J’attends un appel important de la part de mon mari.
supprimer	to remove / to delete	1	edeb184493b1094be0ec213cf22b5a5b	J’ai supprimé beaucoup de fichiers de son ordinateur.
guère	hardly	1	264d6d3366c906d04a7aa45db89bfc17	Sans un bon investisseur, notre projet ne pourra guère avancer.
douter	to doubt	1	a9f68c1a0f5167802514149f36801fbf	Je doute fortement qu’elle veuille me parler.
un hiver	a winter	1	cb6a189237175724267ed094370d6e58	L’hiver sera froid cette année.
sexuel / sexuelle	sexual	1	d1d30da40bbaf04655ede493964e7343	Pardonne-moi, ce baiser n’avait rien de sexuel.
consulter	to consult	1	d194e185f899b5466d16d7eb4ed32ef9	Elle devrait peut-être consulter un psychiatre.
un renseignement	an information	1	c6df48d99a6f2d621efaa0fe347fccd4	Je dois appeler la secrétaire pour obtener un renseignement.
âgé / âgée	old	1	50461a2c9e3b097a15f7fd8b2553da76	Ma grand-mère est très âgée, mais elle est encore en santé.
ressentir	to feel	1	3c27bbea120bc10f2c6cf6bc0fdc2e9b	Il boit pour ne pas ressentir la douleur.
le fonctionnement	the operation	1	bd67996783fbce0f63bd8ad8d314fae1	Voici le manuel de fonctionnement de l’appareil.
un garçon	a boy	1	5e44987a91231f0dbf2a5be9c9e2be4e	Ma tante a deux filles et un garçon.
parfait / parfaite	perfect	1	1d6d4519a5e2e8bbb75b7bbaed052f16	Il est parfait, je l’aime de tout mon cœur.
une prévision	a forecast	1	e3cfa5e5c5c741c57b4bfc98d9df51df	Quelles sont les prévisions météorologiques pour demain?
quatrième	fourth	1	a0ed5185a30a6ba0650bdddef3195088	Il est arrivé en retard pour la quatrième fois ce mois-ci.
une fenêtre	a window	1	4e65c099da3ceee057b1758392975f45	Qui a laissé la fenêtre ouverte?
incapable	incapable	1	b21351c40d41b3f3521cdebbfe775bf8	Ne me dis jamais que je suis incapable de quoi que ce soit.
hésiter	to hesitate	1	8c82758d2b391891831311485fd28a62	Il a hésité avant de lancer le ballon.
résumer	to summarize	1	c93a41964d7c9c179b43a400e3efa914	Pouvez-vous résumer votre projet en cinq minutes?
universel / universelle	universal	1	f7752310139c26383e28108074681917	Le langage mathématique est universel.
la jeunesse	the youth	1	20b28ca48e2f577b1c1f45d970fe65bd	Je donnerais n’importe quoi pour ravoir ma jeunesse.
voler	to steal / to fly	1	877b7e266d0d99bcdef8c47d96f9800e	Il lui a volé son pistolet pendant que l’avion volait à plus de mille pieds d’altitude.
résister	to resist	1	e42556a6713d8da1b6fbcdc2c0519ebd	Il est trop charmant, je ne peux pas lui résister.
profondément	profoundly	1	cbbe0ebe4b753cf77f9b4f87195f3a79	Je suis profondément désolé de ce que j’ai fait.
une menace	a threat	1	6e46736530431355ce5593bd8dd077f7	Ce politicien est une menace envers notre société.
inutile	useless	1	230786da4e4d7c31225b8fb2d5e912cf	Tous mes efforts ont été inutiles.
un refus	a refusal	1	dbc2a6a8edf749884eaafa8a268e8f12	Son refus de coopérer est frustrant.
un poisson	a fish	1	cf4530f4cad6950e8573a7847a7633c2	Cette animalerie vend des poissons exotiques.
une révolution	a revolution	1	caced271baa5708c4e99230ad4e9a289	Ce pays est sur le point de déclencher une révolution.
une séparation	a separation	1	afa72e66684928f14e847a974cf6f005	Ses parents sont au milieu d’une séparation.
avouer	to admit	1	f169ef815ee7a0a954939821c817a4f3	Il se sent coupable, mais il ne va jamais l’avouer.
saluer	to greet / to salute	1	b65feac42a52f009494cce28a24c9c9f	Je vous salue, mademoiselle.
le fer	iron	1	7a0c9ec7dad5ba71a911699c476d92f3	L’acier est plus robuste que le fer.
familial / familiale	family	1	0217ab65d6eda13cb5165e4e274c0004	C’est une tradition familiale.
le cinéma	the cinema	1	8a5124ef0fcc6e7d49196768caf17931	Nous nous sommes rencontrés au cinéma.
prisonnier / prisonnière	prisoner	1	27b194de18b788d5f6b9bff3f6d4b76e	Il est prisonnier de son propre esprit.
armé / armée	armed	1	7b1dc07e8483903ebb795ee0cdd8221f	Ils ont arrêté un homme armé.
un enseignement	a teaching	1	4dc222c9f7b405759712cc1b66c7dd5e	L’enseignement est une vocation.
étonnant / étonnante	surprising	1	e2cfd73a72c1c0b712a7561204fc1588	Vous trouverez que les faits sont étonnants.
une dizaine	ten	1	1f051ff33eea014012c4ac68b703ba51	Il est parti depuis une dizaine de jours.
sur le dessus	on (the) top	1	9a4efeb4f9b64f54d32a82daacce3169	Pourais-tu placer mon ordinateur sur le dessus de la table s’il-te-plaît?
un calcul	a calculation	1	fa0a6cfb0673d10f4922f3e2b5be55ff	On peut obtenir le même résultat avec différents calculs.
un / une fonctionnaire	a state employee	1	ddb5e02d8ef7bcd50ceefb478f80bedf	Il travaille comme fonctionnaire depuis dix ans.
une instruction	an instruction	1	cbdb1a4b005525779014fa0f9983a89e	Les instructions sont accompagnées de schémas.
pratiquement	practically	1	9777e610dcdf1f0b43be082d857b02f7	Il n’y a pratiquement aucun livre intéressant dans cette bibliothèque.
oser	to dare	1	7869027f030dd5ac868a9ed2d25c8f98	Elle n’a pas ôsé repeindre sa cuisine en jaune.
rassembler	to gather	1	b82e6248773c8fdf56933cc49de8cd10	Rassemble tous les documents qui concernent ce procès.
achever	to complete	1	de98bdc11bafbec80fcaa7b467d9b47d	Vous devriez être sur le point d’achever votre travail.
fiscal / fiscale	fiscal	1	45d95a154a808109468f5fd7eec81567	Ce drame fiscal est partout dans les médias.
